bevformer/TemporalSelfAttention/v1.log
[06/28/2024-09:35:34] [V] [TRT] *************** Autotuning Reformat: Float(102400,256,1) -> Float(102400,256,1) ***************
[06/28/2024-09:35:34] [V] [TRT] --------------- Timing Runner: Reformatting CopyNode for Network Input onnx::Unsqueeze_0 (Reformat)
[06/28/2024-09:35:35] [V] [TRT] Tactic: 0x00000000000003e8 Time: 0.0765074
[06/28/2024-09:35:35] [V] [TRT] Tactic: 0x00000000000003ea Time: 0.0965486
[06/28/2024-09:35:35] [V] [TRT] Tactic: 0x0000000000000000 Time: 0.0566613
[06/28/2024-09:35:35] [V] [TRT] Fastest Tactic: 0x0000000000000000 Time: 0.0566613
[06/28/2024-09:35:35] [V] [TRT] >>>>>>>>>>>>>>> Chose Runner Type: Reformat Tactic: 0x0000000000000000
[06/28/2024-09:35:35] [V] [TRT] *************** Autotuning Reformat: Float(102400,256,1) -> Float(1,256,1) ***************
[06/28/2024-09:35:35] [V] [TRT] --------------- Timing Runner: Reformatting CopyNode for Network Input onnx::Unsqueeze_0 (Reformat)
[06/28/2024-09:35:35] [V] [TRT] Tactic: 0x00000000000003e8 Time: 0.130926
[06/28/2024-09:35:35] [V] [TRT] Tactic: 0x00000000000003ea Time: 30.1011
[06/28/2024-09:35:35] [V] [TRT] Tactic: 0x0000000000000000 Time: 0.00936086
[06/28/2024-09:35:35] [V] [TRT] Fastest Tactic: 0x0000000000000000 Time: 0.00936086
[06/28/2024-09:35:35] [V] [TRT] >>>>>>>>>>>>>>> Chose Runner Type: Reformat Tactic: 0x0000000000000000
[06/28/2024-09:35:35] [V] [TRT] *************** Autotuning Reformat: Float(102400,256,1) -> Float(1:4,256,1) ***************
[06/28/2024-09:35:35] [V] [TRT] --------------- Timing Runner: Reformatting CopyNode for Network Input onnx::Unsqueeze_0 (Reformat)
[06/28/2024-09:35:35] [V] [TRT] Tactic: 0x00000000000003e8 Time: 0.0139104
[06/28/2024-09:35:35] [V] [TRT] Tactic: 0x00000000000003ea Time: 0.0119223
[06/28/2024-09:35:35] [V] [TRT] Tactic: 0x0000000000000000 Time: 0.0119912
[06/28/2024-09:35:35] [V] [TRT] Fastest Tactic: 0x00000000000003ea Time: 0.0119223
[06/28/2024-09:35:35] [V] [TRT] >>>>>>>>>>>>>>> Chose Runner Type: Reformat Tactic: 0x00000000000003ea
[06/28/2024-09:35:35] [V] [TRT] *************** Autotuning Reformat: Float(102400,256,1) -> Float(102400:32,256,1) ***************
[06/28/2024-09:35:35] [V] [TRT] --------------- Timing Runner: Reformatting CopyNode for Network Input onnx::Unsqueeze_0 (Reformat)
[06/28/2024-09:35:35] [V] [TRT] Tactic: 0x00000000000003e8 Time: 1.23231
[06/28/2024-09:35:35] [V] [TRT] Tactic: 0x00000000000003ea Time: 0.0992549
[06/28/2024-09:35:35] [V] [TRT] Tactic: 0x0000000000000000 Time: 1.11016
[06/28/2024-09:35:35] [V] [TRT] Fastest Tactic: 0x00000000000003ea Time: 0.0992549
[06/28/2024-09:35:35] [V] [TRT] >>>>>>>>>>>>>>> Chose Runner Type: Reformat Tactic: 0x00000000000003ea
[06/28/2024-09:35:35] [V] [TRT] *************** Autotuning Reformat: Float(102400,256,1) -> Half(102400,256,1) ***************
[06/28/2024-09:35:35] [V] [TRT] --------------- Timing Runner: Reformatting CopyNode for Network Input onnx::Unsqueeze_0 (Reformat)
[06/28/2024-09:35:35] [V] [TRT] Tactic: 0x00000000000003e8 Time: 0.00547081
[06/28/2024-09:35:35] [V] [TRT] Tactic: 0x00000000000003ea Time: 0.0123333
[06/28/2024-09:35:35] [V] [TRT] Tactic: 0x0000000000000000 Time: 0.0105309
[06/28/2024-09:35:35] [V] [TRT] Fastest Tactic: 0x00000000000003e8 Time: 0.00547081
[06/28/2024-09:35:35] [V] [TRT] >>>>>>>>>>>>>>> Chose Runner Type: Reformat Tactic: 0x00000000000003e8
[06/28/2024-09:35:35] [V] [TRT] *************** Autotuning Reformat: Float(102400,256,1) -> Half(102400:2,256,1) ***************
[06/28/2024-09:35:35] [V] [TRT] --------------- Timing Runner: Reformatting CopyNode for Network Input onnx::Unsqueeze_0 (Reformat)
[06/28/2024-09:35:35] [V] [TRT] Tactic: 0x00000000000003e8 Time: 0.0095421
[06/28/2024-09:35:35] [V] [TRT] Tactic: 0x00000000000003ea Time: 0.0143214
[06/28/2024-09:35:35] [V] [TRT] Tactic: 0x0000000000000000 Time: 0.00824762
[06/28/2024-09:35:35] [V] [TRT] Fastest Tactic: 0x0000000000000000 Time: 0.00824762
[06/28/2024-09:35:35] [V] [TRT] >>>>>>>>>>>>>>> Chose Runner Type: Reformat Tactic: 0x0000000000000000
[06/28/2024-09:35:35] [V] [TRT] *************** Autotuning Reformat: Float(102400,256,1) -> Half(1:4,256,1) ***************
[06/28/2024-09:35:35] [V] [TRT] --------------- Timing Runner: Reformatting CopyNode for Network Input onnx::Unsqueeze_0 (Reformat)
[06/28/2024-09:35:35] [V] [TRT] Tactic: 0x00000000000003e8 Time: 0.0139063
[06/28/2024-09:35:35] [V] [TRT] Tactic: 0x00000000000003ea Time: 0.0111024
[06/28/2024-09:35:35] [V] [TRT] Tactic: 0x0000000000000000 Time: 0.0095491
[06/28/2024-09:35:35] [V] [TRT] Fastest Tactic: 0x0000000000000000 Time: 0.0095491
[06/28/2024-09:35:35] [V] [TRT] >>>>>>>>>>>>>>> Chose Runner Type: Reformat Tactic: 0x0000000000000000
[06/28/2024-09:35:35] [V] [TRT] *************** Autotuning Reformat: Float(102400,256,1) -> Half(1:8,256,1) ***************
[06/28/2024-09:35:35] [V] [TRT] --------------- Timing Runner: Reformatting CopyNode for Network Input onnx::Unsqueeze_0 (Reformat)
[06/28/2024-09:35:35] [V] [TRT] Tactic: 0x00000000000003e8 Time: 0.0193491
[06/28/2024-09:35:35] [V] [TRT] Tactic: 0x00000000000003ea Time: 0.024481
[06/28/2024-09:35:35] [V] [TRT] Tactic: 0x0000000000000000 Time: 0.0131566
[06/28/2024-09:35:35] [V] [TRT] Fastest Tactic: 0x0000000000000000 Time: 0.0131566
[06/28/2024-09:35:35] [V] [TRT] >>>>>>>>>>>>>>> Chose Runner Type: Reformat Tactic: 0x0000000000000000
[06/28/2024-09:35:35] [V] [TRT] *************** Autotuning Reformat: Float(102400,256,1) -> Half(1:16,256,1) ***************
[06/28/2024-09:35:35] [V] [TRT] --------------- Timing Runner: Reformatting CopyNode for Network Input onnx::Unsqueeze_0 (Reformat)
[06/28/2024-09:35:35] [V] [TRT] Tactic: 0x00000000000003e8 Time: 0.0344923
[06/28/2024-09:35:35] [V] [TRT] Tactic: 0x00000000000003ea Time: 0.0212108
[06/28/2024-09:35:35] [V] [TRT] Tactic: 0x0000000000000000 Time: 0.034699
[06/28/2024-09:35:35] [V] [TRT] Fastest Tactic: 0x00000000000003ea Time: 0.0212108
[06/28/2024-09:35:35] [V] [TRT] >>>>>>>>>>>>>>> Chose Runner Type: Reformat Tactic: 0x00000000000003ea
[06/28/2024-09:35:35] [V] [TRT] *************** Autotuning Reformat: Float(102400,256,1) -> Half(102400:32,256,1) ***************
[06/28/2024-09:35:35] [V] [TRT] --------------- Timing Runner: Reformatting CopyNode for Network Input onnx::Unsqueeze_0 (Reformat)
[06/28/2024-09:35:35] [V] [TRT] Tactic: 0x00000000000003e8 Time: 0.469138
[06/28/2024-09:35:35] [V] [TRT] Tactic: 0x00000000000003ea Time: 0.0369383
[06/28/2024-09:35:35] [V] [TRT] Tactic: 0x0000000000000000 Time: 0.58251
[06/28/2024-09:35:35] [V] [TRT] Fastest Tactic: 0x00000000000003ea Time: 0.0369383
[06/28/2024-09:35:35] [V] [TRT] >>>>>>>>>>>>>>> Chose Runner Type: Reformat Tactic: 0x00000000000003ea
[06/28/2024-09:35:35] [V] [TRT] *************** Autotuning Reformat: Float(102400,256,1) -> Int8(102400,256,1) ***************
[06/28/2024-09:35:35] [V] [TRT] --------------- Timing Runner: Reformatting CopyNode for Network Input onnx::Unsqueeze_0 (Reformat)
[06/28/2024-09:35:35] [V] [TRT] Tactic: 0x00000000000003e8 Time: 0.00986789
[06/28/2024-09:35:35] [V] [TRT] Tactic: 0x00000000000003ea Time: 0.00597124
[06/28/2024-09:35:35] [V] [TRT] Tactic: 0x0000000000000000 Time: 0.00935743
[06/28/2024-09:35:35] [V] [TRT] Fastest Tactic: 0x00000000000003ea Time: 0.00597124
[06/28/2024-09:35:35] [V] [TRT] >>>>>>>>>>>>>>> Chose Runner Type: Reformat Tactic: 0x00000000000003ea
[06/28/2024-09:35:35] [V] [TRT] *************** Autotuning Reformat: Float(102400,256,1) -> Int8(102400:4,256,1) ***************
[06/28/2024-09:35:35] [V] [TRT] --------------- Timing Runner: Reformatting CopyNode for Network Input onnx::Unsqueeze_0 (Reformat)
[06/28/2024-09:35:35] [V] [TRT] Tactic: 0x00000000000003e8 Time: 0.0156156
[06/28/2024-09:35:35] [V] [TRT] Tactic: 0x00000000000003ea Time: 0.0122221
[06/28/2024-09:35:35] [V] [TRT] Tactic: 0x0000000000000000 Time: 0.0110189
[06/28/2024-09:35:35] [V] [TRT] Fastest Tactic: 0x0000000000000000 Time: 0.0110189
[06/28/2024-09:35:35] [V] [TRT] >>>>>>>>>>>>>>> Chose Runner Type: Reformat Tactic: 0x0000000000000000
[06/28/2024-09:35:35] [V] [TRT] *************** Autotuning Reformat: Float(102400,256,1) -> Int8(102400:32,256,1) ***************
[06/28/2024-09:35:35] [V] [TRT] --------------- Timing Runner: Reformatting CopyNode for Network Input onnx::Unsqueeze_0 (Reformat)
[06/28/2024-09:35:35] [V] [TRT] Tactic: 0x00000000000003e8 Time: 0.167643
[06/28/2024-09:35:35] [V] [TRT] Tactic: 0x00000000000003ea Time: 0.0314514
[06/28/2024-09:35:35] [V] [TRT] Tactic: 0x0000000000000000 Time: 0.16779
[06/28/2024-09:35:35] [V] [TRT] Fastest Tactic: 0x00000000000003ea Time: 0.0314514
[06/28/2024-09:35:35] [V] [TRT] >>>>>>>>>>>>>>> Chose Runner Type: Reformat Tactic: 0x00000000000003ea
[06/28/2024-09:35:35] [V] [TRT] =============== Computing reformatting costs: 
[06/28/2024-09:35:35] [V] [TRT] *************** Autotuning Reformat: Float(102400,256,1) -> Float(1,256,1) ***************
[06/28/2024-09:35:35] [V] [TRT] --------------- Timing Runner: Optimizer Reformat(Reformatted onnx::Unsqueeze_0 -> <out>) (Reformat)
[06/28/2024-09:35:35] [V] [TRT] Setting a default quantization params because quantization data is missing for 
[06/28/2024-09:35:35] [V] [TRT] Tactic: 0x00000000000003e8 Time: 0.007296
[06/28/2024-09:35:35] [V] [TRT] Setting a default quantization params because quantization data is missing for 
[06/28/2024-09:35:35] [V] [TRT] Tactic: 0x00000000000003ea Time: 6.28531
[06/28/2024-09:35:35] [V] [TRT] Setting a default quantization params because quantization data is missing for 
[06/28/2024-09:35:35] [V] [TRT] Tactic: 0x0000000000000000 Time: 0.00719703
[06/28/2024-09:35:35] [V] [TRT] Fastest Tactic: 0x0000000000000000 Time: 0.00719703
[06/28/2024-09:35:35] [V] [TRT] *************** Autotuning Reformat: Float(102400,256,1) -> Float(1:4,256,1) ***************
[06/28/2024-09:35:35] [V] [TRT] --------------- Timing Runner: Optimizer Reformat(Reformatted onnx::Unsqueeze_0 -> <out>) (Reformat)
[06/28/2024-09:35:35] [V] [TRT] Setting a default quantization params because quantization data is missing for 
[06/28/2024-09:35:35] [V] [TRT] Tactic: 0x00000000000003e8 Time: 0.013499
[06/28/2024-09:35:35] [V] [TRT] Setting a default quantization params because quantization data is missing for 
[06/28/2024-09:35:35] [V] [TRT] Tactic: 0x00000000000003ea Time: 0.0135514
[06/28/2024-09:35:35] [V] [TRT] Setting a default quantization params because quantization data is missing for 
[06/28/2024-09:35:35] [V] [TRT] Tactic: 0x0000000000000000 Time: 0.0116944
[06/28/2024-09:35:35] [V] [TRT] Fastest Tactic: 0x0000000000000000 Time: 0.0116944
[06/28/2024-09:35:35] [V] [TRT] *************** Autotuning Reformat: Float(102400,256,1) -> Float(102400:32,256,1) ***************
[06/28/2024-09:35:35] [V] [TRT] --------------- Timing Runner: Optimizer Reformat(Reformatted onnx::Unsqueeze_0 -> <out>) (Reformat)
[06/28/2024-09:35:35] [V] [TRT] Setting a default quantization params because quantization data is missing for 
[06/28/2024-09:35:35] [V] [TRT] Tactic: 0x00000000000003e8 Time: 1.11382
[06/28/2024-09:35:35] [V] [TRT] Setting a default quantization params because quantization data is missing for 
[06/28/2024-09:35:35] [V] [TRT] Tactic: 0x00000000000003ea Time: 0.0998423
[06/28/2024-09:35:35] [V] [TRT] Setting a default quantization params because quantization data is missing for 
[06/28/2024-09:35:35] [V] [TRT] Tactic: 0x0000000000000000 Time: 1.10212
[06/28/2024-09:35:35] [V] [TRT] Fastest Tactic: 0x00000000000003ea Time: 0.0998423
[06/28/2024-09:35:35] [V] [TRT] *************** Autotuning Reformat: Float(102400,256,1) -> Half(102400,256,1) ***************
[06/28/2024-09:35:35] [V] [TRT] --------------- Timing Runner: Optimizer Reformat(Reformatted onnx::Unsqueeze_0 -> <out>) (Reformat)
[06/28/2024-09:35:35] [V] [TRT] Setting a default quantization params because quantization data is missing for 
[06/28/2024-09:35:35] [V] [TRT] Tactic: 0x00000000000003e8 Time: 0.00965851
[06/28/2024-09:35:35] [V] [TRT] Setting a default quantization params because quantization data is missing for 
[06/28/2024-09:35:35] [V] [TRT] Tactic: 0x00000000000003ea Time: 0.0131771
[06/28/2024-09:35:35] [V] [TRT] Setting a default quantization params because quantization data is missing for 
[06/28/2024-09:35:35] [V] [TRT] Tactic: 0x0000000000000000 Time: 0.0179017
[06/28/2024-09:35:35] [V] [TRT] Fastest Tactic: 0x00000000000003e8 Time: 0.00965851
[06/28/2024-09:35:35] [V] [TRT] *************** Autotuning Reformat: Float(102400,256,1) -> Half(102400:2,256,1) ***************
[06/28/2024-09:35:35] [V] [TRT] --------------- Timing Runner: Optimizer Reformat(Reformatted onnx::Unsqueeze_0 -> <out>) (Reformat)
[06/28/2024-09:35:35] [V] [TRT] Setting a default quantization params because quantization data is missing for 
[06/28/2024-09:35:35] [V] [TRT] Tactic: 0x00000000000003e8 Time: 0.0121554
[06/28/2024-09:35:35] [V] [TRT] Setting a default quantization params because quantization data is missing for 
[06/28/2024-09:35:35] [V] [TRT] Tactic: 0x00000000000003ea Time: 0.0166583
[06/28/2024-09:35:35] [V] [TRT] Setting a default quantization params because quantization data is missing for 
[06/28/2024-09:35:35] [V] [TRT] Tactic: 0x0000000000000000 Time: 0.0104807
[06/28/2024-09:35:35] [V] [TRT] Fastest Tactic: 0x0000000000000000 Time: 0.0104807
[06/28/2024-09:35:35] [V] [TRT] *************** Autotuning Reformat: Float(102400,256,1) -> Half(1:4,256,1) ***************
[06/28/2024-09:35:35] [V] [TRT] --------------- Timing Runner: Optimizer Reformat(Reformatted onnx::Unsqueeze_0 -> <out>) (Reformat)
[06/28/2024-09:35:35] [V] [TRT] Setting a default quantization params because quantization data is missing for 
[06/28/2024-09:35:35] [V] [TRT] Tactic: 0x00000000000003e8 Time: 0.0134832
[06/28/2024-09:35:35] [V] [TRT] Setting a default quantization params because quantization data is missing for 
[06/28/2024-09:35:35] [V] [TRT] Tactic: 0x00000000000003ea Time: 0.0103164
[06/28/2024-09:35:35] [V] [TRT] Setting a default quantization params because quantization data is missing for 
[06/28/2024-09:35:35] [V] [TRT] Tactic: 0x0000000000000000 Time: 0.0113807
[06/28/2024-09:35:35] [V] [TRT] Fastest Tactic: 0x00000000000003ea Time: 0.0103164
[06/28/2024-09:35:35] [V] [TRT] *************** Autotuning Reformat: Float(102400,256,1) -> Half(1:8,256,1) ***************
[06/28/2024-09:35:35] [V] [TRT] --------------- Timing Runner: Optimizer Reformat(Reformatted onnx::Unsqueeze_0 -> <out>) (Reformat)
[06/28/2024-09:35:35] [V] [TRT] Setting a default quantization params because quantization data is missing for 
[06/28/2024-09:35:35] [V] [TRT] Tactic: 0x00000000000003e8 Time: 0.018336
[06/28/2024-09:35:35] [V] [TRT] Setting a default quantization params because quantization data is missing for 
[06/28/2024-09:35:35] [V] [TRT] Tactic: 0x00000000000003ea Time: 0.0107833
[06/28/2024-09:35:35] [V] [TRT] Setting a default quantization params because quantization data is missing for 
[06/28/2024-09:35:35] [V] [TRT] Tactic: 0x0000000000000000 Time: 0.0102844
[06/28/2024-09:35:35] [V] [TRT] Fastest Tactic: 0x0000000000000000 Time: 0.0102844
[06/28/2024-09:35:35] [V] [TRT] *************** Autotuning Reformat: Float(102400,256,1) -> Half(1:16,256,1) ***************
[06/28/2024-09:35:35] [V] [TRT] --------------- Timing Runner: Optimizer Reformat(Reformatted onnx::Unsqueeze_0 -> <out>) (Reformat)
[06/28/2024-09:35:35] [V] [TRT] Setting a default quantization params because quantization data is missing for 
[06/28/2024-09:35:35] [V] [TRT] Tactic: 0x00000000000003e8 Time: 0.0301632
[06/28/2024-09:35:35] [V] [TRT] Setting a default quantization params because quantization data is missing for 
[06/28/2024-09:35:35] [V] [TRT] Tactic: 0x00000000000003ea Time: 0.016319
[06/28/2024-09:35:35] [V] [TRT] Setting a default quantization params because quantization data is missing for 
[06/28/2024-09:35:35] [V] [TRT] Tactic: 0x0000000000000000 Time: 0.0290871
[06/28/2024-09:35:35] [V] [TRT] Fastest Tactic: 0x00000000000003ea Time: 0.016319
[06/28/2024-09:35:35] [V] [TRT] *************** Autotuning Reformat: Float(102400,256,1) -> Half(102400:32,256,1) ***************
[06/28/2024-09:35:35] [V] [TRT] --------------- Timing Runner: Optimizer Reformat(Reformatted onnx::Unsqueeze_0 -> <out>) (Reformat)
[06/28/2024-09:35:35] [V] [TRT] Setting a default quantization params because quantization data is missing for 
[06/28/2024-09:35:35] [V] [TRT] Tactic: 0x00000000000003e8 Time: 0.324754
[06/28/2024-09:35:35] [V] [TRT] Setting a default quantization params because quantization data is missing for 
[06/28/2024-09:35:35] [V] [TRT] Tactic: 0x00000000000003ea Time: 0.0316562
[06/28/2024-09:35:35] [V] [TRT] Setting a default quantization params because quantization data is missing for 
[06/28/2024-09:35:35] [V] [TRT] Tactic: 0x0000000000000000 Time: 0.324608
[06/28/2024-09:35:35] [V] [TRT] Fastest Tactic: 0x00000000000003ea Time: 0.0316562
[06/28/2024-09:35:35] [V] [TRT] *************** Autotuning Reformat: Float(102400,256,1) -> Int8(102400,256,1) ***************
[06/28/2024-09:35:35] [V] [TRT] --------------- Timing Runner: Optimizer Reformat(Reformatted onnx::Unsqueeze_0 -> <out>) (Reformat)
[06/28/2024-09:35:35] [V] [TRT] Setting a default quantization params because quantization data is missing for 
[06/28/2024-09:35:35] [V] [TRT] Tactic: 0x00000000000003e8 Time: 0.00952777
[06/28/2024-09:35:35] [V] [TRT] Setting a default quantization params because quantization data is missing for 
[06/28/2024-09:35:35] [V] [TRT] Tactic: 0x00000000000003ea Time: 0.00695902
[06/28/2024-09:35:35] [V] [TRT] Setting a default quantization params because quantization data is missing for 
[06/28/2024-09:35:35] [V] [TRT] Tactic: 0x0000000000000000 Time: 0.00852679
[06/28/2024-09:35:35] [V] [TRT] Fastest Tactic: 0x00000000000003ea Time: 0.00695902
[06/28/2024-09:35:35] [V] [TRT] *************** Autotuning Reformat: Float(102400,256,1) -> Int8(102400:4,256,1) ***************
[06/28/2024-09:35:35] [V] [TRT] --------------- Timing Runner: Optimizer Reformat(Reformatted onnx::Unsqueeze_0 -> <out>) (Reformat)
[06/28/2024-09:35:35] [V] [TRT] Setting a default quantization params because quantization data is missing for 
[06/28/2024-09:35:35] [V] [TRT] Tactic: 0x00000000000003e8 Time: 0.0115341
[06/28/2024-09:35:35] [V] [TRT] Setting a default quantization params because quantization data is missing for 
[06/28/2024-09:35:35] [V] [TRT] Tactic: 0x00000000000003ea Time: 0.00596267
[06/28/2024-09:35:35] [V] [TRT] Setting a default quantization params because quantization data is missing for 
[06/28/2024-09:35:35] [V] [TRT] Tactic: 0x0000000000000000 Time: 0.00971764
[06/28/2024-09:35:35] [V] [TRT] Fastest Tactic: 0x00000000000003ea Time: 0.00596267
[06/28/2024-09:35:35] [V] [TRT] *************** Autotuning Reformat: Float(102400,256,1) -> Int8(102400:32,256,1) ***************
[06/28/2024-09:35:35] [V] [TRT] --------------- Timing Runner: Optimizer Reformat(Reformatted onnx::Unsqueeze_0 -> <out>) (Reformat)
[06/28/2024-09:35:35] [V] [TRT] Setting a default quantization params because quantization data is missing for 
[06/28/2024-09:35:35] [V] [TRT] Tactic: 0x00000000000003e8 Time: 0.140142
[06/28/2024-09:35:35] [V] [TRT] Setting a default quantization params because quantization data is missing for 
[06/28/2024-09:35:35] [V] [TRT] Tactic: 0x00000000000003ea Time: 0.0264777
[06/28/2024-09:35:35] [V] [TRT] Setting a default quantization params because quantization data is missing for 
[06/28/2024-09:35:35] [V] [TRT] Tactic: 0x0000000000000000 Time: 0.140142
[06/28/2024-09:35:35] [V] [TRT] Fastest Tactic: 0x00000000000003ea Time: 0.0264777
[06/28/2024-09:35:35] [V] [TRT] *************** Autotuning Reformat: Float(1,256,1) -> Float(102400,256,1) ***************
[06/28/2024-09:35:35] [V] [TRT] --------------- Timing Runner: Optimizer Reformat(Reformatted onnx::Unsqueeze_0 -> <out>) (Reformat)
[06/28/2024-09:35:35] [V] [TRT] Setting a default quantization params because quantization data is missing for 
[06/28/2024-09:35:35] [V] [TRT] Tactic: 0x00000000000003e8 Time: 0.00796271
[06/28/2024-09:35:35] [V] [TRT] Setting a default quantization params because quantization data is missing for 
[06/28/2024-09:35:35] [V] [TRT] Tactic: 0x00000000000003ea Time: 0.0118959
[06/28/2024-09:35:35] [V] [TRT] Setting a default quantization params because quantization data is missing for 
[06/28/2024-09:35:35] [V] [TRT] Tactic: 0x0000000000000000 Time: 0.00702346
[06/28/2024-09:35:35] [V] [TRT] Fastest Tactic: 0x0000000000000000 Time: 0.00702346
[06/28/2024-09:35:35] [V] [TRT] *************** Autotuning Reformat: Float(1,256,1) -> Float(1:4,256,1) ***************
[06/28/2024-09:35:35] [V] [TRT] --------------- Timing Runner: Optimizer Reformat(Reformatted onnx::Unsqueeze_0 -> <out>) (Reformat)
[06/28/2024-09:35:35] [V] [TRT] Setting a default quantization params because quantization data is missing for 
[06/28/2024-09:35:35] [V] [TRT] Tactic: 0x00000000000003e8 Time: 0.0107546
[06/28/2024-09:35:35] [V] [TRT] Setting a default quantization params because quantization data is missing for 
[06/28/2024-09:35:35] [V] [TRT] Tactic: 0x00000000000003ea Time: 0.0794331
[06/28/2024-09:35:35] [V] [TRT] Setting a default quantization params because quantization data is missing for 
[06/28/2024-09:35:35] [V] [TRT] Tactic: 0x0000000000000000 Time: 0.0103429
[06/28/2024-09:35:35] [V] [TRT] Fastest Tactic: 0x0000000000000000 Time: 0.0103429
[06/28/2024-09:35:35] [V] [TRT] *************** Autotuning Reformat: Float(1,256,1) -> Float(102400:32,256,1) ***************
[06/28/2024-09:35:35] [V] [TRT] --------------- Timing Runner: Optimizer Reformat(Reformatted onnx::Unsqueeze_0 -> <out>) (Reformat)
[06/28/2024-09:35:35] [V] [TRT] Setting a default quantization params because quantization data is missing for 
[06/28/2024-09:35:35] [V] [TRT] Tactic: 0x00000000000003e8 Time: 1.00513
[06/28/2024-09:35:35] [V] [TRT] Setting a default quantization params because quantization data is missing for 
[06/28/2024-09:35:35] [V] [TRT] Tactic: 0x00000000000003ea Time: 0.0792869
[06/28/2024-09:35:35] [V] [TRT] Setting a default quantization params because quantization data is missing for 
[06/28/2024-09:35:35] [V] [TRT] Tactic: 0x0000000000000000 Time: 0.942226
[06/28/2024-09:35:35] [V] [TRT] Fastest Tactic: 0x00000000000003ea Time: 0.0792869
[06/28/2024-09:35:35] [V] [TRT] *************** Autotuning Reformat: Float(1,256,1) -> Half(102400,256,1) ***************
[06/28/2024-09:35:35] [V] [TRT] --------------- Timing Runner: Optimizer Reformat(Reformatted onnx::Unsqueeze_0 -> <out>) (Reformat)
[06/28/2024-09:35:35] [V] [TRT] Setting a default quantization params because quantization data is missing for 
[06/28/2024-09:35:35] [V] [TRT] Tactic: 0x00000000000003e8 Time: 0.00515216
[06/28/2024-09:35:35] [V] [TRT] Setting a default quantization params because quantization data is missing for 
[06/28/2024-09:35:35] [V] [TRT] Tactic: 0x00000000000003ea Time: 0.0106491
[06/28/2024-09:35:35] [V] [TRT] Setting a default quantization params because quantization data is missing for 
[06/28/2024-09:35:35] [V] [TRT] Tactic: 0x0000000000000000 Time: 0.00927429
[06/28/2024-09:35:35] [V] [TRT] Fastest Tactic: 0x00000000000003e8 Time: 0.00515216
[06/28/2024-09:35:35] [V] [TRT] *************** Autotuning Reformat: Float(1,256,1) -> Half(102400:2,256,1) ***************
[06/28/2024-09:35:35] [V] [TRT] --------------- Timing Runner: Optimizer Reformat(Reformatted onnx::Unsqueeze_0 -> <out>) (Reformat)
[06/28/2024-09:35:35] [V] [TRT] Setting a default quantization params because quantization data is missing for 
[06/28/2024-09:35:35] [V] [TRT] Tactic: 0x00000000000003e8 Time: 0.0111761
[06/28/2024-09:35:35] [V] [TRT] Setting a default quantization params because quantization data is missing for 
[06/28/2024-09:35:35] [V] [TRT] Tactic: 0x00000000000003ea Time: 0.0116005
[06/28/2024-09:35:35] [V] [TRT] Setting a default quantization params because quantization data is missing for 
[06/28/2024-09:35:35] [V] [TRT] Tactic: 0x0000000000000000 Time: 0.00782195
[06/28/2024-09:35:35] [V] [TRT] Fastest Tactic: 0x0000000000000000 Time: 0.00782195
[06/28/2024-09:35:35] [V] [TRT] *************** Autotuning Reformat: Float(1,256,1) -> Half(1:4,256,1) ***************
[06/28/2024-09:35:35] [V] [TRT] --------------- Timing Runner: Optimizer Reformat(Reformatted onnx::Unsqueeze_0 -> <out>) (Reformat)
[06/28/2024-09:35:35] [V] [TRT] Setting a default quantization params because quantization data is missing for 
[06/28/2024-09:35:35] [V] [TRT] Tactic: 0x00000000000003e8 Time: 0.0116353
[06/28/2024-09:35:35] [V] [TRT] Setting a default quantization params because quantization data is missing for 
[06/28/2024-09:35:35] [V] [TRT] Tactic: 0x00000000000003ea Time: 0.00869324
[06/28/2024-09:35:35] [V] [TRT] Setting a default quantization params because quantization data is missing for 
[06/28/2024-09:35:35] [V] [TRT] Tactic: 0x0000000000000000 Time: 0.010334
[06/28/2024-09:35:35] [V] [TRT] Fastest Tactic: 0x00000000000003ea Time: 0.00869324
[06/28/2024-09:35:35] [V] [TRT] *************** Autotuning Reformat: Float(1,256,1) -> Half(1:8,256,1) ***************
[06/28/2024-09:35:35] [V] [TRT] --------------- Timing Runner: Optimizer Reformat(Reformatted onnx::Unsqueeze_0 -> <out>) (Reformat)
[06/28/2024-09:35:35] [V] [TRT] Setting a default quantization params because quantization data is missing for 
[06/28/2024-09:35:35] [V] [TRT] Tactic: 0x00000000000003e8 Time: 0.0153024
[06/28/2024-09:35:35] [V] [TRT] Setting a default quantization params because quantization data is missing for 
[06/28/2024-09:35:35] [V] [TRT] Tactic: 0x00000000000003ea Time: 0.0341138
[06/28/2024-09:35:35] [V] [TRT] Setting a default quantization params because quantization data is missing for 
[06/28/2024-09:35:35] [V] [TRT] Tactic: 0x0000000000000000 Time: 0.0182549
[06/28/2024-09:35:35] [V] [TRT] Fastest Tactic: 0x00000000000003e8 Time: 0.0153024
[06/28/2024-09:35:35] [V] [TRT] *************** Autotuning Reformat: Float(1,256,1) -> Half(1:16,256,1) ***************
[06/28/2024-09:35:35] [V] [TRT] --------------- Timing Runner: Optimizer Reformat(Reformatted onnx::Unsqueeze_0 -> <out>) (Reformat)
[06/28/2024-09:35:35] [V] [TRT] Setting a default quantization params because quantization data is missing for 
[06/28/2024-09:35:35] [V] [TRT] Tactic: 0x00000000000003e8 Time: 0.0290834
[06/28/2024-09:35:35] [V] [TRT] Setting a default quantization params because quantization data is missing for 
[06/28/2024-09:35:35] [V] [TRT] Tactic: 0x00000000000003ea Time: 0.0340297
[06/28/2024-09:35:35] [V] [TRT] Setting a default quantization params because quantization data is missing for 
[06/28/2024-09:35:35] [V] [TRT] Tactic: 0x0000000000000000 Time: 0.0290862
[06/28/2024-09:35:35] [V] [TRT] Fastest Tactic: 0x00000000000003e8 Time: 0.0290834
[06/28/2024-09:35:35] [V] [TRT] *************** Autotuning Reformat: Float(1,256,1) -> Half(102400:32,256,1) ***************
[06/28/2024-09:35:35] [V] [TRT] --------------- Timing Runner: Optimizer Reformat(Reformatted onnx::Unsqueeze_0 -> <out>) (Reformat)
[06/28/2024-09:35:35] [V] [TRT] Setting a default quantization params because quantization data is missing for 
[06/28/2024-09:35:35] [V] [TRT] Tactic: 0x00000000000003e8 Time: 0.324475
[06/28/2024-09:35:35] [V] [TRT] Setting a default quantization params because quantization data is missing for 
[06/28/2024-09:35:35] [V] [TRT] Tactic: 0x00000000000003ea Time: 0.0274286
[06/28/2024-09:35:35] [V] [TRT] Setting a default quantization params because quantization data is missing for 
[06/28/2024-09:35:35] [V] [TRT] Tactic: 0x0000000000000000 Time: 0.324462
[06/28/2024-09:35:35] [V] [TRT] Fastest Tactic: 0x00000000000003ea Time: 0.0274286
[06/28/2024-09:35:35] [V] [TRT] *************** Autotuning Reformat: Float(1,256,1) -> Int8(102400,256,1) ***************
[06/28/2024-09:35:35] [V] [TRT] --------------- Timing Runner: Optimizer Reformat(Reformatted onnx::Unsqueeze_0 -> <out>) (Reformat)
[06/28/2024-09:35:35] [V] [TRT] Setting a default quantization params because quantization data is missing for 
[06/28/2024-09:35:35] [V] [TRT] Tactic: 0x00000000000003e8 Time: 0.00919714
[06/28/2024-09:35:35] [V] [TRT] Setting a default quantization params because quantization data is missing for 
[06/28/2024-09:35:35] [V] [TRT] Tactic: 0x00000000000003ea Time: 0.00661403
[06/28/2024-09:35:35] [V] [TRT] Setting a default quantization params because quantization data is missing for 
[06/28/2024-09:35:35] [V] [TRT] Tactic: 0x0000000000000000 Time: 0.00504717
[06/28/2024-09:35:35] [V] [TRT] Fastest Tactic: 0x0000000000000000 Time: 0.00504717
[06/28/2024-09:35:35] [V] [TRT] *************** Autotuning Reformat: Float(1,256,1) -> Int8(102400:4,256,1) ***************
[06/28/2024-09:35:35] [V] [TRT] --------------- Timing Runner: Optimizer Reformat(Reformatted onnx::Unsqueeze_0 -> <out>) (Reformat)
[06/28/2024-09:35:35] [V] [TRT] Setting a default quantization params because quantization data is missing for 
[06/28/2024-09:35:35] [V] [TRT] Tactic: 0x00000000000003e8 Time: 0.0145357
[06/28/2024-09:35:35] [V] [TRT] Setting a default quantization params because quantization data is missing for 
[06/28/2024-09:35:35] [V] [TRT] Tactic: 0x00000000000003ea Time: 0.011444
[06/28/2024-09:35:35] [V] [TRT] Setting a default quantization params because quantization data is missing for 
[06/28/2024-09:35:35] [V] [TRT] Tactic: 0x0000000000000000 Time: 0.012499
[06/28/2024-09:35:35] [V] [TRT] Fastest Tactic: 0x00000000000003ea Time: 0.011444
[06/28/2024-09:35:35] [V] [TRT] *************** Autotuning Reformat: Float(1,256,1) -> Int8(102400:32,256,1) ***************
[06/28/2024-09:35:35] [V] [TRT] --------------- Timing Runner: Optimizer Reformat(Reformatted onnx::Unsqueeze_0 -> <out>) (Reformat)
[06/28/2024-09:35:35] [V] [TRT] Setting a default quantization params because quantization data is missing for 
[06/28/2024-09:35:35] [V] [TRT] Tactic: 0x00000000000003e8 Time: 0.139995
[06/28/2024-09:35:35] [V] [TRT] Setting a default quantization params because quantization data is missing for 
[06/28/2024-09:35:35] [V] [TRT] Tactic: 0x00000000000003ea Time: 0.0309285
[06/28/2024-09:35:35] [V] [TRT] Setting a default quantization params because quantization data is missing for 
[06/28/2024-09:35:35] [V] [TRT] Tactic: 0x0000000000000000 Time: 0.140069
[06/28/2024-09:35:35] [V] [TRT] Fastest Tactic: 0x00000000000003ea Time: 0.0309285
[06/28/2024-09:35:35] [V] [TRT] *************** Autotuning Reformat: Float(1:4,256,1) -> Float(102400,256,1) ***************
[06/28/2024-09:35:35] [V] [TRT] --------------- Timing Runner: Optimizer Reformat(Reformatted onnx::Unsqueeze_0 -> <out>) (Reformat)
[06/28/2024-09:35:35] [V] [TRT] Setting a default quantization params because quantization data is missing for 
[06/28/2024-09:35:35] [V] [TRT] Tactic: 0x00000000000003e8 Time: 0.00898571
[06/28/2024-09:35:35] [V] [TRT] Setting a default quantization params because quantization data is missing for 
[06/28/2024-09:35:35] [V] [TRT] Tactic: 0x00000000000003ea Time: 0.0803063
[06/28/2024-09:35:35] [V] [TRT] Setting a default quantization params because quantization data is missing for 
[06/28/2024-09:35:35] [V] [TRT] Tactic: 0x0000000000000000 Time: 0.00772186
[06/28/2024-09:35:35] [V] [TRT] Fastest Tactic: 0x0000000000000000 Time: 0.00772186
[06/28/2024-09:35:35] [V] [TRT] *************** Autotuning Reformat: Float(1:4,256,1) -> Float(1,256,1) ***************
[06/28/2024-09:35:35] [V] [TRT] --------------- Timing Runner: Optimizer Reformat(Reformatted onnx::Unsqueeze_0 -> <out>) (Reformat)
[06/28/2024-09:35:35] [V] [TRT] Setting a default quantization params because quantization data is missing for 
[06/28/2024-09:35:35] [V] [TRT] Tactic: 0x00000000000003e8 Time: 0.009258
[06/28/2024-09:35:35] [V] [TRT] Setting a default quantization params because quantization data is missing for 
[06/28/2024-09:35:35] [V] [TRT] Tactic: 0x00000000000003ea Time: 0.501906
[06/28/2024-09:35:35] [V] [TRT] Setting a default quantization params because quantization data is missing for 
[06/28/2024-09:35:35] [V] [TRT] Tactic: 0x0000000000000000 Time: 0.00764607
[06/28/2024-09:35:35] [V] [TRT] Fastest Tactic: 0x0000000000000000 Time: 0.00764607
[06/28/2024-09:35:35] [V] [TRT] *************** Autotuning Reformat: Float(1:4,256,1) -> Float(102400:32,256,1) ***************
[06/28/2024-09:35:35] [V] [TRT] --------------- Timing Runner: Optimizer Reformat(Reformatted onnx::Unsqueeze_0 -> <out>) (Reformat)
[06/28/2024-09:35:35] [V] [TRT] Setting a default quantization params because quantization data is missing for 
[06/28/2024-09:35:35] [V] [TRT] Tactic: 0x00000000000003e8 Time: 1.04038
[06/28/2024-09:35:35] [V] [TRT] Setting a default quantization params because quantization data is missing for 
[06/28/2024-09:35:35] [V] [TRT] Tactic: 0x00000000000003ea Time: 0.0797257
[06/28/2024-09:35:35] [V] [TRT] Setting a default quantization params because quantization data is missing for 
[06/28/2024-09:35:35] [V] [TRT] Tactic: 0x0000000000000000 Time: 0.872594
[06/28/2024-09:35:35] [V] [TRT] Fastest Tactic: 0x00000000000003ea Time: 0.0797257
[06/28/2024-09:35:35] [V] [TRT] *************** Autotuning Reformat: Float(1:4,256,1) -> Half(102400,256,1) ***************
[06/28/2024-09:35:35] [V] [TRT] --------------- Timing Runner: Optimizer Reformat(Reformatted onnx::Unsqueeze_0 -> <out>) (Reformat)
[06/28/2024-09:35:35] [V] [TRT] Setting a default quantization params because quantization data is missing for 
[06/28/2024-09:35:35] [V] [TRT] Tactic: 0x00000000000003e8 Time: 0.00515608
[06/28/2024-09:35:35] [V] [TRT] Setting a default quantization params because quantization data is missing for 
[06/28/2024-09:35:35] [V] [TRT] Tactic: 0x00000000000003ea Time: 0.0334702
[06/28/2024-09:35:35] [V] [TRT] Setting a default quantization params because quantization data is missing for 
[06/28/2024-09:35:35] [V] [TRT] Tactic: 0x0000000000000000 Time: 0.010816
[06/28/2024-09:35:35] [V] [TRT] Fastest Tactic: 0x00000000000003e8 Time: 0.00515608
[06/28/2024-09:35:35] [V] [TRT] *************** Autotuning Reformat: Float(1:4,256,1) -> Half(102400:2,256,1) ***************
[06/28/2024-09:35:35] [V] [TRT] --------------- Timing Runner: Optimizer Reformat(Reformatted onnx::Unsqueeze_0 -> <out>) (Reformat)
[06/28/2024-09:35:35] [V] [TRT] Setting a default quantization params because quantization data is missing for 
[06/28/2024-09:35:35] [V] [TRT] Tactic: 0x00000000000003e8 Time: 0.0111487
[06/28/2024-09:35:35] [V] [TRT] Setting a default quantization params because quantization data is missing for 
[06/28/2024-09:35:35] [V] [TRT] Tactic: 0x00000000000003ea Time: 0.0116199
[06/28/2024-09:35:35] [V] [TRT] Setting a default quantization params because quantization data is missing for 
[06/28/2024-09:35:35] [V] [TRT] Tactic: 0x0000000000000000 Time: 0.0109822
[06/28/2024-09:35:35] [V] [TRT] Fastest Tactic: 0x0000000000000000 Time: 0.0109822
[06/28/2024-09:35:35] [V] [TRT] *************** Autotuning Reformat: Float(1:4,256,1) -> Half(1:4,256,1) ***************
[06/28/2024-09:35:35] [V] [TRT] --------------- Timing Runner: Optimizer Reformat(Reformatted onnx::Unsqueeze_0 -> <out>) (Reformat)
[06/28/2024-09:35:35] [V] [TRT] Setting a default quantization params because quantization data is missing for 
[06/28/2024-09:35:35] [V] [TRT] Tactic: 0x00000000000003e8 Time: 0.012024
[06/28/2024-09:35:35] [V] [TRT] Setting a default quantization params because quantization data is missing for 
[06/28/2024-09:35:35] [V] [TRT] Tactic: 0x00000000000003ea Time: 0.00848965
[06/28/2024-09:35:35] [V] [TRT] Setting a default quantization params because quantization data is missing for 
[06/28/2024-09:35:35] [V] [TRT] Tactic: 0x0000000000000000 Time: 0.0110113
[06/28/2024-09:35:35] [V] [TRT] Fastest Tactic: 0x00000000000003ea Time: 0.00848965
[06/28/2024-09:35:35] [V] [TRT] *************** Autotuning Reformat: Float(1:4,256,1) -> Half(1:8,256,1) ***************
[06/28/2024-09:35:35] [V] [TRT] --------------- Timing Runner: Optimizer Reformat(Reformatted onnx::Unsqueeze_0 -> <out>) (Reformat)
[06/28/2024-09:35:35] [V] [TRT] Setting a default quantization params because quantization data is missing for 
[06/28/2024-09:35:35] [V] [TRT] Tactic: 0x00000000000003e8 Time: 0.0158801
[06/28/2024-09:35:35] [V] [TRT] Setting a default quantization params because quantization data is missing for 
[06/28/2024-09:35:35] [V] [TRT] Tactic: 0x00000000000003ea Time: 0.0341138
[06/28/2024-09:35:35] [V] [TRT] Setting a default quantization params because quantization data is missing for 
[06/28/2024-09:35:35] [V] [TRT] Tactic: 0x0000000000000000 Time: 0.0152014
[06/28/2024-09:35:35] [V] [TRT] Fastest Tactic: 0x0000000000000000 Time: 0.0152014
[06/28/2024-09:35:35] [V] [TRT] *************** Autotuning Reformat: Float(1:4,256,1) -> Half(1:16,256,1) ***************
[06/28/2024-09:35:35] [V] [TRT] --------------- Timing Runner: Optimizer Reformat(Reformatted onnx::Unsqueeze_0 -> <out>) (Reformat)
[06/28/2024-09:35:35] [V] [TRT] Setting a default quantization params because quantization data is missing for 
[06/28/2024-09:35:35] [V] [TRT] Tactic: 0x00000000000003e8 Time: 0.0293193
[06/28/2024-09:35:35] [V] [TRT] Setting a default quantization params because quantization data is missing for 
[06/28/2024-09:35:35] [V] [TRT] Tactic: 0x00000000000003ea Time: 0.0342016
[06/28/2024-09:35:35] [V] [TRT] Setting a default quantization params because quantization data is missing for 
[06/28/2024-09:35:35] [V] [TRT] Tactic: 0x0000000000000000 Time: 0.0293157
[06/28/2024-09:35:35] [V] [TRT] Fastest Tactic: 0x0000000000000000 Time: 0.0293157
[06/28/2024-09:35:35] [V] [TRT] *************** Autotuning Reformat: Float(1:4,256,1) -> Half(102400:32,256,1) ***************
[06/28/2024-09:35:35] [V] [TRT] --------------- Timing Runner: Optimizer Reformat(Reformatted onnx::Unsqueeze_0 -> <out>) (Reformat)
[06/28/2024-09:35:35] [V] [TRT] Setting a default quantization params because quantization data is missing for 
[06/28/2024-09:35:35] [V] [TRT] Tactic: 0x00000000000003e8 Time: 0.324901
[06/28/2024-09:35:35] [V] [TRT] Setting a default quantization params because quantization data is missing for 
[06/28/2024-09:35:35] [V] [TRT] Tactic: 0x00000000000003ea Time: 0.0274827
[06/28/2024-09:35:35] [V] [TRT] Setting a default quantization params because quantization data is missing for 
[06/28/2024-09:35:35] [V] [TRT] Tactic: 0x0000000000000000 Time: 0.324754
[06/28/2024-09:35:35] [V] [TRT] Fastest Tactic: 0x00000000000003ea Time: 0.0274827
[06/28/2024-09:35:35] [V] [TRT] *************** Autotuning Reformat: Float(1:4,256,1) -> Int8(102400,256,1) ***************
[06/28/2024-09:35:35] [V] [TRT] --------------- Timing Runner: Optimizer Reformat(Reformatted onnx::Unsqueeze_0 -> <out>) (Reformat)
[06/28/2024-09:35:35] [V] [TRT] Setting a default quantization params because quantization data is missing for 
[06/28/2024-09:35:35] [V] [TRT] Tactic: 0x00000000000003e8 Time: 0.00933082
[06/28/2024-09:35:35] [V] [TRT] Setting a default quantization params because quantization data is missing for 
[06/28/2024-09:35:35] [V] [TRT] Tactic: 0x00000000000003ea Time: 0.0590994
[06/28/2024-09:35:35] [V] [TRT] Setting a default quantization params because quantization data is missing for 
[06/28/2024-09:35:35] [V] [TRT] Tactic: 0x0000000000000000 Time: 0.00921943
[06/28/2024-09:35:35] [V] [TRT] Fastest Tactic: 0x0000000000000000 Time: 0.00921943
[06/28/2024-09:35:35] [V] [TRT] *************** Autotuning Reformat: Float(1:4,256,1) -> Int8(102400:4,256,1) ***************
[06/28/2024-09:35:35] [V] [TRT] --------------- Timing Runner: Optimizer Reformat(Reformatted onnx::Unsqueeze_0 -> <out>) (Reformat)
[06/28/2024-09:35:35] [V] [TRT] Setting a default quantization params because quantization data is missing for 
[06/28/2024-09:35:35] [V] [TRT] Tactic: 0x00000000000003e8 Time: 0.0139429
[06/28/2024-09:35:35] [V] [TRT] Setting a default quantization params because quantization data is missing for 
[06/28/2024-09:35:35] [V] [TRT] Tactic: 0x00000000000003ea Time: 0.0153874
[06/28/2024-09:35:35] [V] [TRT] Setting a default quantization params because quantization data is missing for 
[06/28/2024-09:35:35] [V] [TRT] Tactic: 0x0000000000000000 Time: 0.009492
[06/28/2024-09:35:35] [V] [TRT] Fastest Tactic: 0x0000000000000000 Time: 0.009492
[06/28/2024-09:35:35] [V] [TRT] *************** Autotuning Reformat: Float(1:4,256,1) -> Int8(102400:32,256,1) ***************
[06/28/2024-09:35:35] [V] [TRT] --------------- Timing Runner: Optimizer Reformat(Reformatted onnx::Unsqueeze_0 -> <out>) (Reformat)
[06/28/2024-09:35:35] [V] [TRT] Setting a default quantization params because quantization data is missing for 
[06/28/2024-09:35:35] [V] [TRT] Tactic: 0x00000000000003e8 Time: 0.140288
[06/28/2024-09:35:35] [V] [TRT] Setting a default quantization params because quantization data is missing for 
[06/28/2024-09:35:35] [V] [TRT] Tactic: 0x00000000000003ea Time: 0.0340553
[06/28/2024-09:35:35] [V] [TRT] Setting a default quantization params because quantization data is missing for 
[06/28/2024-09:35:35] [V] [TRT] Tactic: 0x0000000000000000 Time: 0.140361
[06/28/2024-09:35:35] [V] [TRT] Fastest Tactic: 0x00000000000003ea Time: 0.0340553
[06/28/2024-09:35:35] [V] [TRT] *************** Autotuning Reformat: Float(102400:32,256,1) -> Float(102400,256,1) ***************
[06/28/2024-09:35:35] [V] [TRT] --------------- Timing Runner: Optimizer Reformat(Reformatted onnx::Unsqueeze_0 -> <out>) (Reformat)
[06/28/2024-09:35:35] [V] [TRT] Setting a default quantization params because quantization data is missing for 
[06/28/2024-09:35:35] [V] [TRT] Tactic: 0x00000000000003e8 Time: 0.00699494
[06/28/2024-09:35:35] [V] [TRT] Setting a default quantization params because quantization data is missing for 
[06/28/2024-09:35:35] [V] [TRT] Tactic: 0x00000000000003ea Time: 0.0804571
[06/28/2024-09:35:35] [V] [TRT] Setting a default quantization params because quantization data is missing for 
[06/28/2024-09:35:35] [V] [TRT] Tactic: 0x0000000000000000 Time: 0.00571794
[06/28/2024-09:35:35] [V] [TRT] Fastest Tactic: 0x0000000000000000 Time: 0.00571794
[06/28/2024-09:35:35] [V] [TRT] *************** Autotuning Reformat: Float(102400:32,256,1) -> Float(1,256,1) ***************
[06/28/2024-09:35:35] [V] [TRT] --------------- Timing Runner: Optimizer Reformat(Reformatted onnx::Unsqueeze_0 -> <out>) (Reformat)
[06/28/2024-09:35:35] [V] [TRT] Setting a default quantization params because quantization data is missing for 
[06/28/2024-09:35:35] [V] [TRT] Tactic: 0x00000000000003e8 Time: 0.00780174
[06/28/2024-09:35:35] [V] [TRT] Setting a default quantization params because quantization data is missing for 
[06/28/2024-09:35:35] [V] [TRT] Tactic: 0x00000000000003ea Time: 0.537015
[06/28/2024-09:35:35] [V] [TRT] Setting a default quantization params because quantization data is missing for 
[06/28/2024-09:35:35] [V] [TRT] Tactic: 0x0000000000000000 Time: 0.0130464
[06/28/2024-09:35:35] [V] [TRT] Fastest Tactic: 0x00000000000003e8 Time: 0.00780174
[06/28/2024-09:35:35] [V] [TRT] *************** Autotuning Reformat: Float(102400:32,256,1) -> Float(1:4,256,1) ***************
[06/28/2024-09:35:35] [V] [TRT] --------------- Timing Runner: Optimizer Reformat(Reformatted onnx::Unsqueeze_0 -> <out>) (Reformat)
[06/28/2024-09:35:35] [V] [TRT] Setting a default quantization params because quantization data is missing for 
[06/28/2024-09:35:35] [V] [TRT] Tactic: 0x00000000000003e8 Time: 0.0138884
[06/28/2024-09:35:35] [V] [TRT] Setting a default quantization params because quantization data is missing for 
[06/28/2024-09:35:35] [V] [TRT] Tactic: 0x00000000000003ea Time: 0.0797257
[06/28/2024-09:35:35] [V] [TRT] Setting a default quantization params because quantization data is missing for 
[06/28/2024-09:35:35] [V] [TRT] Tactic: 0x0000000000000000 Time: 0.0148279
[06/28/2024-09:35:35] [V] [TRT] Fastest Tactic: 0x00000000000003e8 Time: 0.0138884
[06/28/2024-09:35:35] [V] [TRT] *************** Autotuning Reformat: Float(102400:32,256,1) -> Half(102400,256,1) ***************
[06/28/2024-09:35:35] [V] [TRT] --------------- Timing Runner: Optimizer Reformat(Reformatted onnx::Unsqueeze_0 -> <out>) (Reformat)
[06/28/2024-09:35:35] [V] [TRT] Setting a default quantization params because quantization data is missing for 
[06/28/2024-09:35:35] [V] [TRT] Tactic: 0x00000000000003e8 Time: 0.0106354
[06/28/2024-09:35:35] [V] [TRT] Setting a default quantization params because quantization data is missing for 
[06/28/2024-09:35:35] [V] [TRT] Tactic: 0x00000000000003ea Time: 0.0341696
[06/28/2024-09:35:35] [V] [TRT] Setting a default quantization params because quantization data is missing for 
[06/28/2024-09:35:35] [V] [TRT] Tactic: 0x0000000000000000 Time: 0.00813384
[06/28/2024-09:35:35] [V] [TRT] Fastest Tactic: 0x0000000000000000 Time: 0.00813384
[06/28/2024-09:35:35] [V] [TRT] *************** Autotuning Reformat: Float(102400:32,256,1) -> Half(102400:2,256,1) ***************
[06/28/2024-09:35:35] [V] [TRT] --------------- Timing Runner: Optimizer Reformat(Reformatted onnx::Unsqueeze_0 -> <out>) (Reformat)
[06/28/2024-09:35:35] [V] [TRT] Setting a default quantization params because quantization data is missing for 
[06/28/2024-09:35:35] [V] [TRT] Tactic: 0x00000000000003e8 Time: 0.00710531
[06/28/2024-09:35:35] [V] [TRT] Setting a default quantization params because quantization data is missing for 
[06/28/2024-09:35:35] [V] [TRT] Tactic: 0x00000000000003ea Time: 0.00859751
[06/28/2024-09:35:35] [V] [TRT] Setting a default quantization params because quantization data is missing for 
[06/28/2024-09:35:35] [V] [TRT] Tactic: 0x0000000000000000 Time: 0.00729691
[06/28/2024-09:35:35] [V] [TRT] Fastest Tactic: 0x00000000000003e8 Time: 0.00710531
[06/28/2024-09:35:35] [V] [TRT] *************** Autotuning Reformat: Float(102400:32,256,1) -> Half(1:4,256,1) ***************
[06/28/2024-09:35:35] [V] [TRT] --------------- Timing Runner: Optimizer Reformat(Reformatted onnx::Unsqueeze_0 -> <out>) (Reformat)
[06/28/2024-09:35:35] [V] [TRT] Setting a default quantization params because quantization data is missing for 
[06/28/2024-09:35:35] [V] [TRT] Tactic: 0x00000000000003e8 Time: 0.0106266
[06/28/2024-09:35:35] [V] [TRT] Setting a default quantization params because quantization data is missing for 
[06/28/2024-09:35:35] [V] [TRT] Tactic: 0x00000000000003ea Time: 0.0086158
[06/28/2024-09:35:35] [V] [TRT] Setting a default quantization params because quantization data is missing for 
[06/28/2024-09:35:35] [V] [TRT] Tactic: 0x0000000000000000 Time: 0.0130248
[06/28/2024-09:35:35] [V] [TRT] Fastest Tactic: 0x00000000000003ea Time: 0.0086158
[06/28/2024-09:35:35] [V] [TRT] *************** Autotuning Reformat: Float(102400:32,256,1) -> Half(1:8,256,1) ***************
[06/28/2024-09:35:35] [V] [TRT] --------------- Timing Runner: Optimizer Reformat(Reformatted onnx::Unsqueeze_0 -> <out>) (Reformat)
[06/28/2024-09:35:35] [V] [TRT] Setting a default quantization params because quantization data is missing for 
[06/28/2024-09:35:35] [V] [TRT] Tactic: 0x00000000000003e8 Time: 0.0169366
[06/28/2024-09:35:35] [V] [TRT] Setting a default quantization params because quantization data is missing for 
[06/28/2024-09:35:35] [V] [TRT] Tactic: 0x00000000000003ea Time: 0.0341083
[06/28/2024-09:35:35] [V] [TRT] Setting a default quantization params because quantization data is missing for 
[06/28/2024-09:35:35] [V] [TRT] Tactic: 0x0000000000000000 Time: 0.0172754
[06/28/2024-09:35:35] [V] [TRT] Fastest Tactic: 0x00000000000003e8 Time: 0.0169366
[06/28/2024-09:35:35] [V] [TRT] *************** Autotuning Reformat: Float(102400:32,256,1) -> Half(1:16,256,1) ***************
[06/28/2024-09:35:35] [V] [TRT] --------------- Timing Runner: Optimizer Reformat(Reformatted onnx::Unsqueeze_0 -> <out>) (Reformat)
[06/28/2024-09:35:35] [V] [TRT] Setting a default quantization params because quantization data is missing for 
[06/28/2024-09:35:35] [V] [TRT] Tactic: 0x00000000000003e8 Time: 0.0310117
[06/28/2024-09:35:35] [V] [TRT] Setting a default quantization params because quantization data is missing for 
[06/28/2024-09:35:35] [V] [TRT] Tactic: 0x00000000000003ea Time: 0.0340846
[06/28/2024-09:35:35] [V] [TRT] Setting a default quantization params because quantization data is missing for 
[06/28/2024-09:35:35] [V] [TRT] Tactic: 0x0000000000000000 Time: 0.0310117
[06/28/2024-09:35:35] [V] [TRT] Fastest Tactic: 0x00000000000003e8 Time: 0.0310117
[06/28/2024-09:35:35] [V] [TRT] *************** Autotuning Reformat: Float(102400:32,256,1) -> Half(102400:32,256,1) ***************
[06/28/2024-09:35:35] [V] [TRT] --------------- Timing Runner: Optimizer Reformat(Reformatted onnx::Unsqueeze_0 -> <out>) (Reformat)
[06/28/2024-09:35:35] [V] [TRT] Setting a default quantization params because quantization data is missing for 
[06/28/2024-09:35:35] [V] [TRT] Tactic: 0x00000000000003e8 Time: 0.326363
[06/28/2024-09:35:35] [V] [TRT] Setting a default quantization params because quantization data is missing for 
[06/28/2024-09:35:35] [V] [TRT] Tactic: 0x00000000000003ea Time: 0.0275017
[06/28/2024-09:35:35] [V] [TRT] Setting a default quantization params because quantization data is missing for 
[06/28/2024-09:35:35] [V] [TRT] Tactic: 0x0000000000000000 Time: 0.326363
[06/28/2024-09:35:35] [V] [TRT] Fastest Tactic: 0x00000000000003ea Time: 0.0275017
[06/28/2024-09:35:35] [V] [TRT] *************** Autotuning Reformat: Float(102400:32,256,1) -> Int8(102400,256,1) ***************
[06/28/2024-09:35:35] [V] [TRT] --------------- Timing Runner: Optimizer Reformat(Reformatted onnx::Unsqueeze_0 -> <out>) (Reformat)
[06/28/2024-09:35:35] [V] [TRT] Setting a default quantization params because quantization data is missing for 
[06/28/2024-09:35:35] [V] [TRT] Tactic: 0x00000000000003e8 Time: 0.007808
[06/28/2024-09:35:35] [V] [TRT] Setting a default quantization params because quantization data is missing for 
[06/28/2024-09:35:35] [V] [TRT] Tactic: 0x00000000000003ea Time: 0.0591482
[06/28/2024-09:35:35] [V] [TRT] Setting a default quantization params because quantization data is missing for 
[06/28/2024-09:35:35] [V] [TRT] Tactic: 0x0000000000000000 Time: 0.00697469
[06/28/2024-09:35:35] [V] [TRT] Fastest Tactic: 0x0000000000000000 Time: 0.00697469
[06/28/2024-09:35:35] [V] [TRT] *************** Autotuning Reformat: Float(102400:32,256,1) -> Int8(102400:4,256,1) ***************
[06/28/2024-09:35:35] [V] [TRT] --------------- Timing Runner: Optimizer Reformat(Reformatted onnx::Unsqueeze_0 -> <out>) (Reformat)
[06/28/2024-09:35:35] [V] [TRT] Setting a default quantization params because quantization data is missing for 
[06/28/2024-09:35:35] [V] [TRT] Tactic: 0x00000000000003e8 Time: 0.0102671
[06/28/2024-09:35:35] [V] [TRT] Setting a default quantization params because quantization data is missing for 
[06/28/2024-09:35:35] [V] [TRT] Tactic: 0x00000000000003ea Time: 0.0367909
[06/28/2024-09:35:35] [V] [TRT] Setting a default quantization params because quantization data is missing for 
[06/28/2024-09:35:35] [V] [TRT] Tactic: 0x0000000000000000 Time: 0.0147479
[06/28/2024-09:35:35] [V] [TRT] Fastest Tactic: 0x00000000000003e8 Time: 0.0102671
[06/28/2024-09:35:35] [V] [TRT] *************** Autotuning Reformat: Float(102400:32,256,1) -> Int8(102400:32,256,1) ***************
[06/28/2024-09:35:35] [V] [TRT] --------------- Timing Runner: Optimizer Reformat(Reformatted onnx::Unsqueeze_0 -> <out>) (Reformat)
[06/28/2024-09:35:35] [V] [TRT] Setting a default quantization params because quantization data is missing for 
[06/28/2024-09:35:35] [V] [TRT] Tactic: 0x00000000000003e8 Time: 0.141897
[06/28/2024-09:35:35] [V] [TRT] Setting a default quantization params because quantization data is missing for 
[06/28/2024-09:35:35] [V] [TRT] Tactic: 0x00000000000003ea Time: 0.0346112
[06/28/2024-09:35:35] [V] [TRT] Setting a default quantization params because quantization data is missing for 
[06/28/2024-09:35:35] [V] [TRT] Tactic: 0x0000000000000000 Time: 0.141897
[06/28/2024-09:35:35] [V] [TRT] Fastest Tactic: 0x00000000000003ea Time: 0.0346112
[06/28/2024-09:35:35] [V] [TRT] *************** Autotuning Reformat: Half(102400,256,1) -> Float(102400,256,1) ***************
[06/28/2024-09:35:35] [V] [TRT] --------------- Timing Runner: Optimizer Reformat(Reformatted onnx::Unsqueeze_0 -> <out>) (Reformat)
[06/28/2024-09:35:35] [V] [TRT] Setting a default quantization params because quantization data is missing for 
[06/28/2024-09:35:35] [V] [TRT] Tactic: 0x00000000000003e8 Time: 0.00791063
[06/28/2024-09:35:35] [V] [TRT] Setting a default quantization params because quantization data is missing for 
[06/28/2024-09:35:35] [V] [TRT] Tactic: 0x00000000000003ea Time: 0.0111494
[06/28/2024-09:35:35] [V] [TRT] Setting a default quantization params because quantization data is missing for 
[06/28/2024-09:35:35] [V] [TRT] Tactic: 0x0000000000000000 Time: 0.00632865
[06/28/2024-09:35:35] [V] [TRT] Fastest Tactic: 0x0000000000000000 Time: 0.00632865
[06/28/2024-09:35:35] [V] [TRT] *************** Autotuning Reformat: Half(102400,256,1) -> Float(1,256,1) ***************
[06/28/2024-09:35:35] [V] [TRT] --------------- Timing Runner: Optimizer Reformat(Reformatted onnx::Unsqueeze_0 -> <out>) (Reformat)
[06/28/2024-09:35:35] [V] [TRT] Setting a default quantization params because quantization data is missing for 
[06/28/2024-09:35:35] [V] [TRT] Tactic: 0x00000000000003e8 Time: 0.00691026
[06/28/2024-09:35:35] [V] [TRT] Setting a default quantization params because quantization data is missing for 
[06/28/2024-09:35:35] [V] [TRT] Tactic: 0x00000000000003ea Time: 1.17584
[06/28/2024-09:35:35] [V] [TRT] Setting a default quantization params because quantization data is missing for 
[06/28/2024-09:35:35] [V] [TRT] Tactic: 0x0000000000000000 Time: 0.00912486
[06/28/2024-09:35:35] [V] [TRT] Fastest Tactic: 0x00000000000003e8 Time: 0.00691026
[06/28/2024-09:35:35] [V] [TRT] *************** Autotuning Reformat: Half(102400,256,1) -> Float(1:4,256,1) ***************
[06/28/2024-09:35:35] [V] [TRT] --------------- Timing Runner: Optimizer Reformat(Reformatted onnx::Unsqueeze_0 -> <out>) (Reformat)
[06/28/2024-09:35:35] [V] [TRT] Setting a default quantization params because quantization data is missing for 
[06/28/2024-09:35:35] [V] [TRT] Tactic: 0x00000000000003e8 Time: 0.0116142
[06/28/2024-09:35:35] [V] [TRT] Setting a default quantization params because quantization data is missing for 
[06/28/2024-09:35:35] [V] [TRT] Tactic: 0x00000000000003ea Time: 0.0323328
[06/28/2024-09:35:35] [V] [TRT] Setting a default quantization params because quantization data is missing for 
[06/28/2024-09:35:35] [V] [TRT] Tactic: 0x0000000000000000 Time: 0.0111613
[06/28/2024-09:35:35] [V] [TRT] Fastest Tactic: 0x0000000000000000 Time: 0.0111613
[06/28/2024-09:35:35] [V] [TRT] *************** Autotuning Reformat: Half(102400,256,1) -> Float(102400:32,256,1) ***************
[06/28/2024-09:35:35] [V] [TRT] --------------- Timing Runner: Optimizer Reformat(Reformatted onnx::Unsqueeze_0 -> <out>) (Reformat)
[06/28/2024-09:35:35] [V] [TRT] Setting a default quantization params because quantization data is missing for 
[06/28/2024-09:35:35] [V] [TRT] Tactic: 0x00000000000003e8 Time: 0.942226
[06/28/2024-09:35:35] [V] [TRT] Setting a default quantization params because quantization data is missing for 
[06/28/2024-09:35:35] [V] [TRT] Tactic: 0x00000000000003ea Time: 0.0266278
[06/28/2024-09:35:35] [V] [TRT] Setting a default quantization params because quantization data is missing for 
[06/28/2024-09:35:35] [V] [TRT] Tactic: 0x0000000000000000 Time: 1.03102
[06/28/2024-09:35:35] [V] [TRT] Fastest Tactic: 0x00000000000003ea Time: 0.0266278
[06/28/2024-09:35:35] [V] [TRT] *************** Autotuning Reformat: Half(102400,256,1) -> Half(102400:2,256,1) ***************
[06/28/2024-09:35:35] [V] [TRT] --------------- Timing Runner: Optimizer Reformat(Reformatted onnx::Unsqueeze_0 -> <out>) (Reformat)
[06/28/2024-09:35:35] [V] [TRT] Setting a default quantization params because quantization data is missing for 
[06/28/2024-09:35:35] [V] [TRT] Tactic: 0x00000000000003e8 Time: 0.00663293
[06/28/2024-09:35:35] [V] [TRT] Setting a default quantization params because quantization data is missing for 
[06/28/2024-09:35:35] [V] [TRT] Tactic: 0x00000000000003ea Time: 0.00757221
[06/28/2024-09:35:35] [V] [TRT] Setting a default quantization params because quantization data is missing for 
[06/28/2024-09:35:35] [V] [TRT] Tactic: 0x0000000000000000 Time: 0.00683755
[06/28/2024-09:35:35] [V] [TRT] Fastest Tactic: 0x00000000000003e8 Time: 0.00663293
[06/28/2024-09:35:35] [V] [TRT] *************** Autotuning Reformat: Half(102400,256,1) -> Half(1:4,256,1) ***************
[06/28/2024-09:35:35] [V] [TRT] --------------- Timing Runner: Optimizer Reformat(Reformatted onnx::Unsqueeze_0 -> <out>) (Reformat)
[06/28/2024-09:35:35] [V] [TRT] Setting a default quantization params because quantization data is missing for 
[06/28/2024-09:35:35] [V] [TRT] Tactic: 0x00000000000003e8 Time: 0.0111951
[06/28/2024-09:35:35] [V] [TRT] Setting a default quantization params because quantization data is missing for 
[06/28/2024-09:35:35] [V] [TRT] Tactic: 0x00000000000003ea Time: 0.0121352
[06/28/2024-09:35:35] [V] [TRT] Setting a default quantization params because quantization data is missing for 
[06/28/2024-09:35:35] [V] [TRT] Tactic: 0x0000000000000000 Time: 0.02048
[06/28/2024-09:35:35] [V] [TRT] Fastest Tactic: 0x00000000000003e8 Time: 0.0111951
[06/28/2024-09:35:35] [V] [TRT] *************** Autotuning Reformat: Half(102400,256,1) -> Half(1:8,256,1) ***************
[06/28/2024-09:35:35] [V] [TRT] --------------- Timing Runner: Optimizer Reformat(Reformatted onnx::Unsqueeze_0 -> <out>) (Reformat)
[06/28/2024-09:35:35] [V] [TRT] Setting a default quantization params because quantization data is missing for 
[06/28/2024-09:35:35] [V] [TRT] Tactic: 0x00000000000003e8 Time: 0.0159345
[06/28/2024-09:35:35] [V] [TRT] Setting a default quantization params because quantization data is missing for 
[06/28/2024-09:35:35] [V] [TRT] Tactic: 0x00000000000003ea Time: 0.0134051
[06/28/2024-09:35:35] [V] [TRT] Setting a default quantization params because quantization data is missing for 
[06/28/2024-09:35:35] [V] [TRT] Tactic: 0x0000000000000000 Time: 0.0117714
[06/28/2024-09:35:35] [V] [TRT] Fastest Tactic: 0x0000000000000000 Time: 0.0117714
[06/28/2024-09:35:35] [V] [TRT] *************** Autotuning Reformat: Half(102400,256,1) -> Half(1:16,256,1) ***************
[06/28/2024-09:35:35] [V] [TRT] --------------- Timing Runner: Optimizer Reformat(Reformatted onnx::Unsqueeze_0 -> <out>) (Reformat)
[06/28/2024-09:35:35] [V] [TRT] Setting a default quantization params because quantization data is missing for 
[06/28/2024-09:35:35] [V] [TRT] Tactic: 0x00000000000003e8 Time: 0.0290523
[06/28/2024-09:35:35] [V] [TRT] Setting a default quantization params because quantization data is missing for 
[06/28/2024-09:35:35] [V] [TRT] Tactic: 0x00000000000003ea Time: 0.0196206
[06/28/2024-09:35:35] [V] [TRT] Setting a default quantization params because quantization data is missing for 
[06/28/2024-09:35:35] [V] [TRT] Tactic: 0x0000000000000000 Time: 0.0297006
[06/28/2024-09:35:35] [V] [TRT] Fastest Tactic: 0x00000000000003ea Time: 0.0196206
[06/28/2024-09:35:35] [V] [TRT] *************** Autotuning Reformat: Half(102400,256,1) -> Half(102400:32,256,1) ***************
[06/28/2024-09:35:35] [V] [TRT] --------------- Timing Runner: Optimizer Reformat(Reformatted onnx::Unsqueeze_0 -> <out>) (Reformat)
[06/28/2024-09:35:35] [V] [TRT] Setting a default quantization params because quantization data is missing for 
[06/28/2024-09:35:35] [V] [TRT] Tactic: 0x00000000000003e8 Time: 0.324608
[06/28/2024-09:35:35] [V] [TRT] Setting a default quantization params because quantization data is missing for 
[06/28/2024-09:35:35] [V] [TRT] Tactic: 0x00000000000003ea Time: 0.034112
[06/28/2024-09:35:35] [V] [TRT] Setting a default quantization params because quantization data is missing for 
[06/28/2024-09:35:35] [V] [TRT] Tactic: 0x0000000000000000 Time: 0.324462
[06/28/2024-09:35:35] [V] [TRT] Fastest Tactic: 0x00000000000003ea Time: 0.034112
[06/28/2024-09:35:35] [V] [TRT] *************** Autotuning Reformat: Half(102400,256,1) -> Int8(102400,256,1) ***************
[06/28/2024-09:35:35] [V] [TRT] --------------- Timing Runner: Optimizer Reformat(Reformatted onnx::Unsqueeze_0 -> <out>) (Reformat)
[06/28/2024-09:35:35] [V] [TRT] Setting a default quantization params because quantization data is missing for 
[06/28/2024-09:35:35] [V] [TRT] Tactic: 0x00000000000003e8 Time: 0.0102553
[06/28/2024-09:35:35] [V] [TRT] Setting a default quantization params because quantization data is missing for 
[06/28/2024-09:35:35] [V] [TRT] Tactic: 0x00000000000003ea Time: 0.0105992
[06/28/2024-09:35:35] [V] [TRT] Setting a default quantization params because quantization data is missing for 
[06/28/2024-09:35:35] [V] [TRT] Tactic: 0x0000000000000000 Time: 0.00768866
[06/28/2024-09:35:35] [V] [TRT] Fastest Tactic: 0x0000000000000000 Time: 0.00768866
[06/28/2024-09:35:35] [V] [TRT] *************** Autotuning Reformat: Half(102400,256,1) -> Int8(102400:4,256,1) ***************
[06/28/2024-09:35:35] [V] [TRT] --------------- Timing Runner: Optimizer Reformat(Reformatted onnx::Unsqueeze_0 -> <out>) (Reformat)
[06/28/2024-09:35:35] [V] [TRT] Setting a default quantization params because quantization data is missing for 
[06/28/2024-09:35:35] [V] [TRT] Tactic: 0x00000000000003e8 Time: 0.0104454
[06/28/2024-09:35:35] [V] [TRT] Setting a default quantization params because quantization data is missing for 
[06/28/2024-09:35:35] [V] [TRT] Tactic: 0x00000000000003ea Time: 0.00851792
[06/28/2024-09:35:35] [V] [TRT] Setting a default quantization params because quantization data is missing for 
[06/28/2024-09:35:35] [V] [TRT] Tactic: 0x0000000000000000 Time: 0.00975055
[06/28/2024-09:35:35] [V] [TRT] Fastest Tactic: 0x00000000000003ea Time: 0.00851792
[06/28/2024-09:35:35] [V] [TRT] *************** Autotuning Reformat: Half(102400,256,1) -> Int8(102400:32,256,1) ***************
[06/28/2024-09:35:35] [V] [TRT] --------------- Timing Runner: Optimizer Reformat(Reformatted onnx::Unsqueeze_0 -> <out>) (Reformat)
[06/28/2024-09:35:35] [V] [TRT] Setting a default quantization params because quantization data is missing for 
[06/28/2024-09:35:35] [V] [TRT] Tactic: 0x00000000000003e8 Time: 0.140069
[06/28/2024-09:35:35] [V] [TRT] Setting a default quantization params because quantization data is missing for 
[06/28/2024-09:35:35] [V] [TRT] Tactic: 0x00000000000003ea Time: 0.0261608
[06/28/2024-09:35:35] [V] [TRT] Setting a default quantization params because quantization data is missing for 
[06/28/2024-09:35:35] [V] [TRT] Tactic: 0x0000000000000000 Time: 0.14
[06/28/2024-09:35:35] [V] [TRT] Fastest Tactic: 0x00000000000003ea Time: 0.0261608
[06/28/2024-09:35:35] [V] [TRT] *************** Autotuning Reformat: Half(102400:2,256,1) -> Float(102400,256,1) ***************
[06/28/2024-09:35:35] [V] [TRT] --------------- Timing Runner: Optimizer Reformat(Reformatted onnx::Unsqueeze_0 -> <out>) (Reformat)
[06/28/2024-09:35:35] [V] [TRT] Setting a default quantization params because quantization data is missing for 
[06/28/2024-09:35:35] [V] [TRT] Tactic: 0x00000000000003e8 Time: 0.00736228
[06/28/2024-09:35:35] [V] [TRT] Setting a default quantization params because quantization data is missing for 
[06/28/2024-09:35:35] [V] [TRT] Tactic: 0x00000000000003ea Time: 0.01902
[06/28/2024-09:35:35] [V] [TRT] Setting a default quantization params because quantization data is missing for 
[06/28/2024-09:35:35] [V] [TRT] Tactic: 0x0000000000000000 Time: 0.00935286
[06/28/2024-09:35:35] [V] [TRT] Fastest Tactic: 0x00000000000003e8 Time: 0.00736228
[06/28/2024-09:35:35] [V] [TRT] *************** Autotuning Reformat: Half(102400:2,256,1) -> Float(1,256,1) ***************
