bevformer/TemporalSelfAttention/v2.log
[06/28/2024-09:33:50] [V] [TRT] *************** Autotuning Reformat: Float(102400,256,1) -> Float(102400,256,1) ***************
[06/28/2024-09:33:50] [V] [TRT] --------------- Timing Runner: Reformatting CopyNode for Network Input query (Reformat)
[06/28/2024-09:33:50] [V] [TRT] Tactic: 0x00000000000003e8 Time: 1.31628
[06/28/2024-09:33:50] [V] [TRT] Tactic: 0x00000000000003ea Time: 0.106715
[06/28/2024-09:33:50] [V] [TRT] Tactic: 0x0000000000000000 Time: 0.830683
[06/28/2024-09:33:50] [V] [TRT] Fastest Tactic: 0x00000000000003ea Time: 0.106715
[06/28/2024-09:33:50] [V] [TRT] >>>>>>>>>>>>>>> Chose Runner Type: Reformat Tactic: 0x00000000000003ea
[06/28/2024-09:33:50] [V] [TRT] *************** Autotuning Reformat: Float(102400,256,1) -> Float(1,256,1) ***************
[06/28/2024-09:33:50] [V] [TRT] --------------- Timing Runner: Reformatting CopyNode for Network Input query (Reformat)
[06/28/2024-09:33:50] [V] [TRT] Tactic: 0x00000000000003e8 Time: 0.123758
[06/28/2024-09:33:50] [V] [TRT] Tactic: 0x00000000000003ea Time: 6.66522
[06/28/2024-09:33:50] [V] [TRT] Tactic: 0x0000000000000000 Time: 0.0110674
[06/28/2024-09:33:50] [V] [TRT] Fastest Tactic: 0x0000000000000000 Time: 0.0110674
[06/28/2024-09:33:50] [V] [TRT] >>>>>>>>>>>>>>> Chose Runner Type: Reformat Tactic: 0x0000000000000000
[06/28/2024-09:33:50] [V] [TRT] *************** Autotuning Reformat: Float(102400,256,1) -> Float(1:4,256,1) ***************
[06/28/2024-09:33:50] [V] [TRT] --------------- Timing Runner: Reformatting CopyNode for Network Input query (Reformat)
[06/28/2024-09:33:50] [V] [TRT] Tactic: 0x00000000000003e8 Time: 0.0136021
[06/28/2024-09:33:50] [V] [TRT] Tactic: 0x00000000000003ea Time: 0.0136208
[06/28/2024-09:33:50] [V] [TRT] Tactic: 0x0000000000000000 Time: 0.0133436
[06/28/2024-09:33:50] [V] [TRT] Fastest Tactic: 0x0000000000000000 Time: 0.0133436
[06/28/2024-09:33:50] [V] [TRT] >>>>>>>>>>>>>>> Chose Runner Type: Reformat Tactic: 0x0000000000000000
[06/28/2024-09:33:50] [V] [TRT] *************** Autotuning Reformat: Float(102400,256,1) -> Float(102400:32,256,1) ***************
[06/28/2024-09:33:50] [V] [TRT] --------------- Timing Runner: Reformatting CopyNode for Network Input query (Reformat)
[06/28/2024-09:33:50] [V] [TRT] Tactic: 0x00000000000003e8 Time: 1.11075
[06/28/2024-09:33:50] [V] [TRT] Tactic: 0x00000000000003ea Time: 0.099328
[06/28/2024-09:33:50] [V] [TRT] Tactic: 0x0000000000000000 Time: 1.25586
[06/28/2024-09:33:50] [V] [TRT] Fastest Tactic: 0x00000000000003ea Time: 0.099328
[06/28/2024-09:33:50] [V] [TRT] >>>>>>>>>>>>>>> Chose Runner Type: Reformat Tactic: 0x00000000000003ea
[06/28/2024-09:33:50] [V] [TRT] *************** Autotuning Reformat: Float(102400,256,1) -> Half(102400,256,1) ***************
[06/28/2024-09:33:50] [V] [TRT] --------------- Timing Runner: Reformatting CopyNode for Network Input query (Reformat)
[06/28/2024-09:33:50] [V] [TRT] Tactic: 0x00000000000003e8 Time: 0.0053633
[06/28/2024-09:33:50] [V] [TRT] Tactic: 0x00000000000003ea Time: 0.00903857
[06/28/2024-09:33:50] [V] [TRT] Tactic: 0x0000000000000000 Time: 0.00842337
[06/28/2024-09:33:50] [V] [TRT] Fastest Tactic: 0x00000000000003e8 Time: 0.0053633
[06/28/2024-09:33:50] [V] [TRT] >>>>>>>>>>>>>>> Chose Runner Type: Reformat Tactic: 0x00000000000003e8
[06/28/2024-09:33:50] [V] [TRT] *************** Autotuning Reformat: Float(102400,256,1) -> Half(102400:2,256,1) ***************
[06/28/2024-09:33:50] [V] [TRT] --------------- Timing Runner: Reformatting CopyNode for Network Input query (Reformat)
[06/28/2024-09:33:50] [V] [TRT] Tactic: 0x00000000000003e8 Time: 0.0163959
[06/28/2024-09:33:50] [V] [TRT] Tactic: 0x00000000000003ea Time: 0.0187783
[06/28/2024-09:33:50] [V] [TRT] Tactic: 0x0000000000000000 Time: 0.00805847
[06/28/2024-09:33:50] [V] [TRT] Fastest Tactic: 0x0000000000000000 Time: 0.00805847
[06/28/2024-09:33:50] [V] [TRT] >>>>>>>>>>>>>>> Chose Runner Type: Reformat Tactic: 0x0000000000000000
[06/28/2024-09:33:50] [V] [TRT] *************** Autotuning Reformat: Float(102400,256,1) -> Half(1:4,256,1) ***************
[06/28/2024-09:33:50] [V] [TRT] --------------- Timing Runner: Reformatting CopyNode for Network Input query (Reformat)
[06/28/2024-09:33:50] [V] [TRT] Tactic: 0x00000000000003e8 Time: 0.0137209
[06/28/2024-09:33:50] [V] [TRT] Tactic: 0x00000000000003ea Time: 0.0110217
[06/28/2024-09:33:50] [V] [TRT] Tactic: 0x0000000000000000 Time: 0.01069
[06/28/2024-09:33:50] [V] [TRT] Fastest Tactic: 0x0000000000000000 Time: 0.01069
[06/28/2024-09:33:50] [V] [TRT] >>>>>>>>>>>>>>> Chose Runner Type: Reformat Tactic: 0x0000000000000000
[06/28/2024-09:33:50] [V] [TRT] *************** Autotuning Reformat: Float(102400,256,1) -> Half(1:8,256,1) ***************
[06/28/2024-09:33:50] [V] [TRT] --------------- Timing Runner: Reformatting CopyNode for Network Input query (Reformat)
[06/28/2024-09:33:50] [V] [TRT] Tactic: 0x00000000000003e8 Time: 0.0186571
[06/28/2024-09:33:50] [V] [TRT] Tactic: 0x00000000000003ea Time: 0.0146002
[06/28/2024-09:33:50] [V] [TRT] Tactic: 0x0000000000000000 Time: 0.0136133
[06/28/2024-09:33:50] [V] [TRT] Fastest Tactic: 0x0000000000000000 Time: 0.0136133
[06/28/2024-09:33:50] [V] [TRT] >>>>>>>>>>>>>>> Chose Runner Type: Reformat Tactic: 0x0000000000000000
[06/28/2024-09:33:50] [V] [TRT] *************** Autotuning Reformat: Float(102400,256,1) -> Half(1:16,256,1) ***************
[06/28/2024-09:33:50] [V] [TRT] --------------- Timing Runner: Reformatting CopyNode for Network Input query (Reformat)
[06/28/2024-09:33:50] [V] [TRT] Tactic: 0x00000000000003e8 Time: 0.0359783
[06/28/2024-09:33:50] [V] [TRT] Tactic: 0x00000000000003ea Time: 0.0214851
[06/28/2024-09:33:50] [V] [TRT] Tactic: 0x0000000000000000 Time: 0.0345527
[06/28/2024-09:33:50] [V] [TRT] Fastest Tactic: 0x00000000000003ea Time: 0.0214851
[06/28/2024-09:33:50] [V] [TRT] >>>>>>>>>>>>>>> Chose Runner Type: Reformat Tactic: 0x00000000000003ea
[06/28/2024-09:33:50] [V] [TRT] *************** Autotuning Reformat: Float(102400,256,1) -> Half(102400:32,256,1) ***************
[06/28/2024-09:33:50] [V] [TRT] --------------- Timing Runner: Reformatting CopyNode for Network Input query (Reformat)
[06/28/2024-09:33:50] [V] [TRT] Tactic: 0x00000000000003e8 Time: 0.469431
[06/28/2024-09:33:50] [V] [TRT] Tactic: 0x00000000000003ea Time: 0.0396137
[06/28/2024-09:33:50] [V] [TRT] Tactic: 0x0000000000000000 Time: 0.607232
[06/28/2024-09:33:50] [V] [TRT] Fastest Tactic: 0x00000000000003ea Time: 0.0396137
[06/28/2024-09:33:50] [V] [TRT] >>>>>>>>>>>>>>> Chose Runner Type: Reformat Tactic: 0x00000000000003ea
[06/28/2024-09:33:50] [V] [TRT] *************** Autotuning Reformat: Float(102400,256,1) -> Int8(102400,256,1) ***************
[06/28/2024-09:33:50] [V] [TRT] --------------- Timing Runner: Reformatting CopyNode for Network Input query (Reformat)
[06/28/2024-09:33:51] [V] [TRT] Tactic: 0x00000000000003e8 Time: 0.00986362
[06/28/2024-09:33:51] [V] [TRT] Tactic: 0x00000000000003ea Time: 0.00613276
[06/28/2024-09:33:51] [V] [TRT] Tactic: 0x0000000000000000 Time: 0.00575982
[06/28/2024-09:33:51] [V] [TRT] Fastest Tactic: 0x0000000000000000 Time: 0.00575982
[06/28/2024-09:33:51] [V] [TRT] >>>>>>>>>>>>>>> Chose Runner Type: Reformat Tactic: 0x0000000000000000
[06/28/2024-09:33:51] [V] [TRT] *************** Autotuning Reformat: Float(102400,256,1) -> Int8(102400:4,256,1) ***************
[06/28/2024-09:33:51] [V] [TRT] --------------- Timing Runner: Reformatting CopyNode for Network Input query (Reformat)
[06/28/2024-09:33:51] [V] [TRT] Tactic: 0x00000000000003e8 Time: 0.0099331
[06/28/2024-09:33:51] [V] [TRT] Tactic: 0x00000000000003ea Time: 0.00830552
[06/28/2024-09:33:51] [V] [TRT] Tactic: 0x0000000000000000 Time: 0.00619962
[06/28/2024-09:33:51] [V] [TRT] Fastest Tactic: 0x0000000000000000 Time: 0.00619962
[06/28/2024-09:33:51] [V] [TRT] >>>>>>>>>>>>>>> Chose Runner Type: Reformat Tactic: 0x0000000000000000
[06/28/2024-09:33:51] [V] [TRT] *************** Autotuning Reformat: Float(102400,256,1) -> Int8(102400:32,256,1) ***************
[06/28/2024-09:33:51] [V] [TRT] --------------- Timing Runner: Reformatting CopyNode for Network Input query (Reformat)
[06/28/2024-09:33:51] [V] [TRT] Tactic: 0x00000000000003e8 Time: 0.139771
[06/28/2024-09:33:51] [V] [TRT] Tactic: 0x00000000000003ea Time: 0.0262392
[06/28/2024-09:33:51] [V] [TRT] Tactic: 0x0000000000000000 Time: 0.139687
[06/28/2024-09:33:51] [V] [TRT] Fastest Tactic: 0x00000000000003ea Time: 0.0262392
[06/28/2024-09:33:51] [V] [TRT] >>>>>>>>>>>>>>> Chose Runner Type: Reformat Tactic: 0x00000000000003ea
[06/28/2024-09:33:51] [V] [TRT] =============== Computing reformatting costs: 
[06/28/2024-09:33:51] [V] [TRT] *************** Autotuning Reformat: Float(102400,256,1) -> Float(1,256,1) ***************
[06/28/2024-09:33:51] [V] [TRT] --------------- Timing Runner: Optimizer Reformat(Reformatted query -> <out>) (Reformat)
[06/28/2024-09:33:51] [V] [TRT] Setting a default quantization params because quantization data is missing for 
[06/28/2024-09:33:51] [V] [TRT] Tactic: 0x00000000000003e8 Time: 0.00617417
[06/28/2024-09:33:51] [V] [TRT] Setting a default quantization params because quantization data is missing for 
[06/28/2024-09:33:51] [V] [TRT] Tactic: 0x00000000000003ea Time: 5.28574
[06/28/2024-09:33:51] [V] [TRT] Setting a default quantization params because quantization data is missing for 
[06/28/2024-09:33:51] [V] [TRT] Tactic: 0x0000000000000000 Time: 0.00749829
[06/28/2024-09:33:51] [V] [TRT] Fastest Tactic: 0x00000000000003e8 Time: 0.00617417
[06/28/2024-09:33:51] [V] [TRT] *************** Autotuning Reformat: Float(102400,256,1) -> Float(1:4,256,1) ***************
[06/28/2024-09:33:51] [V] [TRT] --------------- Timing Runner: Optimizer Reformat(Reformatted query -> <out>) (Reformat)
[06/28/2024-09:33:51] [V] [TRT] Setting a default quantization params because quantization data is missing for 
[06/28/2024-09:33:51] [V] [TRT] Tactic: 0x00000000000003e8 Time: 0.0154085
[06/28/2024-09:33:51] [V] [TRT] Setting a default quantization params because quantization data is missing for 
[06/28/2024-09:33:51] [V] [TRT] Tactic: 0x00000000000003ea Time: 0.014464
[06/28/2024-09:33:51] [V] [TRT] Setting a default quantization params because quantization data is missing for 
[06/28/2024-09:33:51] [V] [TRT] Tactic: 0x0000000000000000 Time: 0.0138988
[06/28/2024-09:33:51] [V] [TRT] Fastest Tactic: 0x0000000000000000 Time: 0.0138988
[06/28/2024-09:33:51] [V] [TRT] *************** Autotuning Reformat: Float(102400,256,1) -> Float(102400:32,256,1) ***************
[06/28/2024-09:33:51] [V] [TRT] --------------- Timing Runner: Optimizer Reformat(Reformatted query -> <out>) (Reformat)
[06/28/2024-09:33:51] [V] [TRT] Setting a default quantization params because quantization data is missing for 
[06/28/2024-09:33:51] [V] [TRT] Tactic: 0x00000000000003e8 Time: 0.930962
[06/28/2024-09:33:51] [V] [TRT] Setting a default quantization params because quantization data is missing for 
[06/28/2024-09:33:51] [V] [TRT] Tactic: 0x00000000000003ea Time: 0.0833829
[06/28/2024-09:33:51] [V] [TRT] Setting a default quantization params because quantization data is missing for 
[06/28/2024-09:33:51] [V] [TRT] Tactic: 0x0000000000000000 Time: 1.10124
[06/28/2024-09:33:51] [V] [TRT] Fastest Tactic: 0x00000000000003ea Time: 0.0833829
[06/28/2024-09:33:51] [V] [TRT] *************** Autotuning Reformat: Float(102400,256,1) -> Half(102400,256,1) ***************
[06/28/2024-09:33:51] [V] [TRT] --------------- Timing Runner: Optimizer Reformat(Reformatted query -> <out>) (Reformat)
[06/28/2024-09:33:51] [V] [TRT] Setting a default quantization params because quantization data is missing for 
[06/28/2024-09:33:51] [V] [TRT] Tactic: 0x00000000000003e8 Time: 0.00599124
[06/28/2024-09:33:51] [V] [TRT] Setting a default quantization params because quantization data is missing for 
[06/28/2024-09:33:51] [V] [TRT] Tactic: 0x00000000000003ea Time: 0.0137745
[06/28/2024-09:33:51] [V] [TRT] Setting a default quantization params because quantization data is missing for 
[06/28/2024-09:33:51] [V] [TRT] Tactic: 0x0000000000000000 Time: 0.00923229
[06/28/2024-09:33:51] [V] [TRT] Fastest Tactic: 0x00000000000003e8 Time: 0.00599124
[06/28/2024-09:33:51] [V] [TRT] *************** Autotuning Reformat: Float(102400,256,1) -> Half(102400:2,256,1) ***************
[06/28/2024-09:33:51] [V] [TRT] --------------- Timing Runner: Optimizer Reformat(Reformatted query -> <out>) (Reformat)
[06/28/2024-09:33:51] [V] [TRT] Setting a default quantization params because quantization data is missing for 
[06/28/2024-09:33:51] [V] [TRT] Tactic: 0x00000000000003e8 Time: 0.011276
[06/28/2024-09:33:51] [V] [TRT] Setting a default quantization params because quantization data is missing for 
[06/28/2024-09:33:51] [V] [TRT] Tactic: 0x00000000000003ea Time: 0.0137525
[06/28/2024-09:33:51] [V] [TRT] Setting a default quantization params because quantization data is missing for 
[06/28/2024-09:33:51] [V] [TRT] Tactic: 0x0000000000000000 Time: 0.00873089
[06/28/2024-09:33:51] [V] [TRT] Fastest Tactic: 0x0000000000000000 Time: 0.00873089
[06/28/2024-09:33:51] [V] [TRT] *************** Autotuning Reformat: Float(102400,256,1) -> Half(1:4,256,1) ***************
[06/28/2024-09:33:51] [V] [TRT] --------------- Timing Runner: Optimizer Reformat(Reformatted query -> <out>) (Reformat)
[06/28/2024-09:33:51] [V] [TRT] Setting a default quantization params because quantization data is missing for 
[06/28/2024-09:33:51] [V] [TRT] Tactic: 0x00000000000003e8 Time: 0.0130988
[06/28/2024-09:33:51] [V] [TRT] Setting a default quantization params because quantization data is missing for 
[06/28/2024-09:33:51] [V] [TRT] Tactic: 0x00000000000003ea Time: 0.0167203
[06/28/2024-09:33:51] [V] [TRT] Setting a default quantization params because quantization data is missing for 
[06/28/2024-09:33:51] [V] [TRT] Tactic: 0x0000000000000000 Time: 0.0131341
[06/28/2024-09:33:51] [V] [TRT] Fastest Tactic: 0x00000000000003e8 Time: 0.0130988
[06/28/2024-09:33:51] [V] [TRT] *************** Autotuning Reformat: Float(102400,256,1) -> Half(1:8,256,1) ***************
[06/28/2024-09:33:51] [V] [TRT] --------------- Timing Runner: Optimizer Reformat(Reformatted query -> <out>) (Reformat)
[06/28/2024-09:33:51] [V] [TRT] Setting a default quantization params because quantization data is missing for 
[06/28/2024-09:33:51] [V] [TRT] Tactic: 0x00000000000003e8 Time: 0.0172658
[06/28/2024-09:33:51] [V] [TRT] Setting a default quantization params because quantization data is missing for 
[06/28/2024-09:33:51] [V] [TRT] Tactic: 0x00000000000003ea Time: 0.0147163
[06/28/2024-09:33:51] [V] [TRT] Setting a default quantization params because quantization data is missing for 
[06/28/2024-09:33:51] [V] [TRT] Tactic: 0x0000000000000000 Time: 0.0124701
[06/28/2024-09:33:51] [V] [TRT] Fastest Tactic: 0x0000000000000000 Time: 0.0124701
[06/28/2024-09:33:51] [V] [TRT] *************** Autotuning Reformat: Float(102400,256,1) -> Half(1:16,256,1) ***************
[06/28/2024-09:33:51] [V] [TRT] --------------- Timing Runner: Optimizer Reformat(Reformatted query -> <out>) (Reformat)
[06/28/2024-09:33:51] [V] [TRT] Setting a default quantization params because quantization data is missing for 
[06/28/2024-09:33:51] [V] [TRT] Tactic: 0x00000000000003e8 Time: 0.0291959
[06/28/2024-09:33:51] [V] [TRT] Setting a default quantization params because quantization data is missing for 
[06/28/2024-09:33:51] [V] [TRT] Tactic: 0x00000000000003ea Time: 0.0190354
[06/28/2024-09:33:51] [V] [TRT] Setting a default quantization params because quantization data is missing for 
[06/28/2024-09:33:51] [V] [TRT] Tactic: 0x0000000000000000 Time: 0.0291794
[06/28/2024-09:33:51] [V] [TRT] Fastest Tactic: 0x00000000000003ea Time: 0.0190354
[06/28/2024-09:33:51] [V] [TRT] *************** Autotuning Reformat: Float(102400,256,1) -> Half(102400:32,256,1) ***************
[06/28/2024-09:33:51] [V] [TRT] --------------- Timing Runner: Optimizer Reformat(Reformatted query -> <out>) (Reformat)
[06/28/2024-09:33:51] [V] [TRT] Setting a default quantization params because quantization data is missing for 
[06/28/2024-09:33:51] [V] [TRT] Tactic: 0x00000000000003e8 Time: 0.324754
[06/28/2024-09:33:51] [V] [TRT] Setting a default quantization params because quantization data is missing for 
[06/28/2024-09:33:51] [V] [TRT] Tactic: 0x00000000000003ea Time: 0.0311013
[06/28/2024-09:33:51] [V] [TRT] Setting a default quantization params because quantization data is missing for 
[06/28/2024-09:33:51] [V] [TRT] Tactic: 0x0000000000000000 Time: 0.324754
[06/28/2024-09:33:51] [V] [TRT] Fastest Tactic: 0x00000000000003ea Time: 0.0311013
[06/28/2024-09:33:51] [V] [TRT] *************** Autotuning Reformat: Float(102400,256,1) -> Int8(102400,256,1) ***************
[06/28/2024-09:33:51] [V] [TRT] --------------- Timing Runner: Optimizer Reformat(Reformatted query -> <out>) (Reformat)
[06/28/2024-09:33:51] [V] [TRT] Setting a default quantization params because quantization data is missing for 
[06/28/2024-09:33:51] [V] [TRT] Tactic: 0x00000000000003e8 Time: 0.0056276
[06/28/2024-09:33:51] [V] [TRT] Setting a default quantization params because quantization data is missing for 
[06/28/2024-09:33:51] [V] [TRT] Tactic: 0x00000000000003ea Time: 0.00768457
[06/28/2024-09:33:51] [V] [TRT] Setting a default quantization params because quantization data is missing for 
[06/28/2024-09:33:51] [V] [TRT] Tactic: 0x0000000000000000 Time: 0.00881802
[06/28/2024-09:33:51] [V] [TRT] Fastest Tactic: 0x00000000000003e8 Time: 0.0056276
[06/28/2024-09:33:51] [V] [TRT] *************** Autotuning Reformat: Float(102400,256,1) -> Int8(102400:4,256,1) ***************
[06/28/2024-09:33:51] [V] [TRT] --------------- Timing Runner: Optimizer Reformat(Reformatted query -> <out>) (Reformat)
[06/28/2024-09:33:51] [V] [TRT] Setting a default quantization params because quantization data is missing for 
[06/28/2024-09:33:51] [V] [TRT] Tactic: 0x00000000000003e8 Time: 0.0117915
[06/28/2024-09:33:51] [V] [TRT] Setting a default quantization params because quantization data is missing for 
[06/28/2024-09:33:51] [V] [TRT] Tactic: 0x00000000000003ea Time: 0.0116733
[06/28/2024-09:33:51] [V] [TRT] Setting a default quantization params because quantization data is missing for 
[06/28/2024-09:33:51] [V] [TRT] Tactic: 0x0000000000000000 Time: 0.0109479
[06/28/2024-09:33:51] [V] [TRT] Fastest Tactic: 0x0000000000000000 Time: 0.0109479
[06/28/2024-09:33:51] [V] [TRT] *************** Autotuning Reformat: Float(102400,256,1) -> Int8(102400:32,256,1) ***************
[06/28/2024-09:33:51] [V] [TRT] --------------- Timing Runner: Optimizer Reformat(Reformatted query -> <out>) (Reformat)
[06/28/2024-09:33:51] [V] [TRT] Setting a default quantization params because quantization data is missing for 
[06/28/2024-09:33:51] [V] [TRT] Tactic: 0x00000000000003e8 Time: 0.140217
[06/28/2024-09:33:51] [V] [TRT] Setting a default quantization params because quantization data is missing for 
[06/28/2024-09:33:51] [V] [TRT] Tactic: 0x00000000000003ea Time: 0.0263764
[06/28/2024-09:33:51] [V] [TRT] Setting a default quantization params because quantization data is missing for 
[06/28/2024-09:33:51] [V] [TRT] Tactic: 0x0000000000000000 Time: 0.140213
[06/28/2024-09:33:51] [V] [TRT] Fastest Tactic: 0x00000000000003ea Time: 0.0263764
[06/28/2024-09:33:51] [V] [TRT] *************** Autotuning Reformat: Float(1,256,1) -> Float(102400,256,1) ***************
[06/28/2024-09:33:51] [V] [TRT] --------------- Timing Runner: Optimizer Reformat(Reformatted query -> <out>) (Reformat)
[06/28/2024-09:33:51] [V] [TRT] Setting a default quantization params because quantization data is missing for 
[06/28/2024-09:33:51] [V] [TRT] Tactic: 0x00000000000003e8 Time: 0.00590757
[06/28/2024-09:33:51] [V] [TRT] Setting a default quantization params because quantization data is missing for 
[06/28/2024-09:33:51] [V] [TRT] Tactic: 0x00000000000003ea Time: 0.00581431
[06/28/2024-09:33:51] [V] [TRT] Setting a default quantization params because quantization data is missing for 
[06/28/2024-09:33:51] [V] [TRT] Tactic: 0x0000000000000000 Time: 0.005027
[06/28/2024-09:33:51] [V] [TRT] Fastest Tactic: 0x0000000000000000 Time: 0.005027
[06/28/2024-09:33:51] [V] [TRT] *************** Autotuning Reformat: Float(1,256,1) -> Float(1:4,256,1) ***************
[06/28/2024-09:33:51] [V] [TRT] --------------- Timing Runner: Optimizer Reformat(Reformatted query -> <out>) (Reformat)
[06/28/2024-09:33:51] [V] [TRT] Setting a default quantization params because quantization data is missing for 
[06/28/2024-09:33:51] [V] [TRT] Tactic: 0x00000000000003e8 Time: 0.0119745
[06/28/2024-09:33:51] [V] [TRT] Setting a default quantization params because quantization data is missing for 
[06/28/2024-09:33:51] [V] [TRT] Tactic: 0x00000000000003ea Time: 0.0794331
[06/28/2024-09:33:51] [V] [TRT] Setting a default quantization params because quantization data is missing for 
[06/28/2024-09:33:51] [V] [TRT] Tactic: 0x0000000000000000 Time: 0.00987229
[06/28/2024-09:33:51] [V] [TRT] Fastest Tactic: 0x0000000000000000 Time: 0.00987229
[06/28/2024-09:33:51] [V] [TRT] *************** Autotuning Reformat: Float(1,256,1) -> Float(102400:32,256,1) ***************
[06/28/2024-09:33:51] [V] [TRT] --------------- Timing Runner: Optimizer Reformat(Reformatted query -> <out>) (Reformat)
[06/28/2024-09:33:51] [V] [TRT] Setting a default quantization params because quantization data is missing for 
[06/28/2024-09:33:51] [V] [TRT] Tactic: 0x00000000000003e8 Time: 1.04828
[06/28/2024-09:33:51] [V] [TRT] Setting a default quantization params because quantization data is missing for 
[06/28/2024-09:33:51] [V] [TRT] Tactic: 0x00000000000003ea Time: 0.07936
[06/28/2024-09:33:51] [V] [TRT] Setting a default quantization params because quantization data is missing for 
[06/28/2024-09:33:51] [V] [TRT] Tactic: 0x0000000000000000 Time: 0.930962
[06/28/2024-09:33:51] [V] [TRT] Fastest Tactic: 0x00000000000003ea Time: 0.07936
[06/28/2024-09:33:51] [V] [TRT] *************** Autotuning Reformat: Float(1,256,1) -> Half(102400,256,1) ***************
[06/28/2024-09:33:51] [V] [TRT] --------------- Timing Runner: Optimizer Reformat(Reformatted query -> <out>) (Reformat)
[06/28/2024-09:33:51] [V] [TRT] Setting a default quantization params because quantization data is missing for 
[06/28/2024-09:33:51] [V] [TRT] Tactic: 0x00000000000003e8 Time: 0.00857734
[06/28/2024-09:33:51] [V] [TRT] Setting a default quantization params because quantization data is missing for 
[06/28/2024-09:33:51] [V] [TRT] Tactic: 0x00000000000003ea Time: 0.0130626
[06/28/2024-09:33:51] [V] [TRT] Setting a default quantization params because quantization data is missing for 
[06/28/2024-09:33:51] [V] [TRT] Tactic: 0x0000000000000000 Time: 0.0200677
[06/28/2024-09:33:51] [V] [TRT] Fastest Tactic: 0x00000000000003e8 Time: 0.00857734
[06/28/2024-09:33:51] [V] [TRT] *************** Autotuning Reformat: Float(1,256,1) -> Half(102400:2,256,1) ***************
[06/28/2024-09:33:51] [V] [TRT] --------------- Timing Runner: Optimizer Reformat(Reformatted query -> <out>) (Reformat)
[06/28/2024-09:33:51] [V] [TRT] Setting a default quantization params because quantization data is missing for 
[06/28/2024-09:33:51] [V] [TRT] Tactic: 0x00000000000003e8 Time: 0.0111441
[06/28/2024-09:33:51] [V] [TRT] Setting a default quantization params because quantization data is missing for 
[06/28/2024-09:33:51] [V] [TRT] Tactic: 0x00000000000003ea Time: 0.016257
[06/28/2024-09:33:51] [V] [TRT] Setting a default quantization params because quantization data is missing for 
[06/28/2024-09:33:51] [V] [TRT] Tactic: 0x0000000000000000 Time: 0.0106109
[06/28/2024-09:33:51] [V] [TRT] Fastest Tactic: 0x0000000000000000 Time: 0.0106109
[06/28/2024-09:33:51] [V] [TRT] *************** Autotuning Reformat: Float(1,256,1) -> Half(1:4,256,1) ***************
[06/28/2024-09:33:51] [V] [TRT] --------------- Timing Runner: Optimizer Reformat(Reformatted query -> <out>) (Reformat)
[06/28/2024-09:33:51] [V] [TRT] Setting a default quantization params because quantization data is missing for 
[06/28/2024-09:33:51] [V] [TRT] Tactic: 0x00000000000003e8 Time: 0.0136598
[06/28/2024-09:33:51] [V] [TRT] Setting a default quantization params because quantization data is missing for 
[06/28/2024-09:33:51] [V] [TRT] Tactic: 0x00000000000003ea Time: 0.0143653
[06/28/2024-09:33:51] [V] [TRT] Setting a default quantization params because quantization data is missing for 
[06/28/2024-09:33:51] [V] [TRT] Tactic: 0x0000000000000000 Time: 0.0134982
[06/28/2024-09:33:51] [V] [TRT] Fastest Tactic: 0x0000000000000000 Time: 0.0134982
[06/28/2024-09:33:51] [V] [TRT] *************** Autotuning Reformat: Float(1,256,1) -> Half(1:8,256,1) ***************
[06/28/2024-09:33:51] [V] [TRT] --------------- Timing Runner: Optimizer Reformat(Reformatted query -> <out>) (Reformat)
[06/28/2024-09:33:51] [V] [TRT] Setting a default quantization params because quantization data is missing for 
[06/28/2024-09:33:51] [V] [TRT] Tactic: 0x00000000000003e8 Time: 0.0155941
[06/28/2024-09:33:51] [V] [TRT] Setting a default quantization params because quantization data is missing for 
[06/28/2024-09:33:51] [V] [TRT] Tactic: 0x00000000000003ea Time: 0.0340873
[06/28/2024-09:33:51] [V] [TRT] Setting a default quantization params because quantization data is missing for 
[06/28/2024-09:33:51] [V] [TRT] Tactic: 0x0000000000000000 Time: 0.015515
[06/28/2024-09:33:51] [V] [TRT] Fastest Tactic: 0x0000000000000000 Time: 0.015515
[06/28/2024-09:33:51] [V] [TRT] *************** Autotuning Reformat: Float(1,256,1) -> Half(1:16,256,1) ***************
[06/28/2024-09:33:51] [V] [TRT] --------------- Timing Runner: Optimizer Reformat(Reformatted query -> <out>) (Reformat)
[06/28/2024-09:33:51] [V] [TRT] Setting a default quantization params because quantization data is missing for 
[06/28/2024-09:33:51] [V] [TRT] Tactic: 0x00000000000003e8 Time: 0.0292571
[06/28/2024-09:33:51] [V] [TRT] Setting a default quantization params because quantization data is missing for 
[06/28/2024-09:33:51] [V] [TRT] Tactic: 0x00000000000003ea Time: 0.0342025
[06/28/2024-09:33:51] [V] [TRT] Setting a default quantization params because quantization data is missing for 
[06/28/2024-09:33:51] [V] [TRT] Tactic: 0x0000000000000000 Time: 0.0291675
[06/28/2024-09:33:51] [V] [TRT] Fastest Tactic: 0x0000000000000000 Time: 0.0291675
[06/28/2024-09:33:51] [V] [TRT] *************** Autotuning Reformat: Float(1,256,1) -> Half(102400:32,256,1) ***************
[06/28/2024-09:33:51] [V] [TRT] --------------- Timing Runner: Optimizer Reformat(Reformatted query -> <out>) (Reformat)
[06/28/2024-09:33:51] [V] [TRT] Setting a default quantization params because quantization data is missing for 
[06/28/2024-09:33:51] [V] [TRT] Tactic: 0x00000000000003e8 Time: 0.324754
[06/28/2024-09:33:51] [V] [TRT] Setting a default quantization params because quantization data is missing for 
[06/28/2024-09:33:51] [V] [TRT] Tactic: 0x00000000000003ea Time: 0.0274941
[06/28/2024-09:33:51] [V] [TRT] Setting a default quantization params because quantization data is missing for 
[06/28/2024-09:33:51] [V] [TRT] Tactic: 0x0000000000000000 Time: 0.324608
[06/28/2024-09:33:51] [V] [TRT] Fastest Tactic: 0x00000000000003ea Time: 0.0274941
[06/28/2024-09:33:51] [V] [TRT] *************** Autotuning Reformat: Float(1,256,1) -> Int8(102400,256,1) ***************
[06/28/2024-09:33:51] [V] [TRT] --------------- Timing Runner: Optimizer Reformat(Reformatted query -> <out>) (Reformat)
[06/28/2024-09:33:51] [V] [TRT] Setting a default quantization params because quantization data is missing for 
[06/28/2024-09:33:51] [V] [TRT] Tactic: 0x00000000000003e8 Time: 0.00868464
[06/28/2024-09:33:51] [V] [TRT] Setting a default quantization params because quantization data is missing for 
[06/28/2024-09:33:51] [V] [TRT] Tactic: 0x00000000000003ea Time: 0.0121954
[06/28/2024-09:33:51] [V] [TRT] Setting a default quantization params because quantization data is missing for 
[06/28/2024-09:33:51] [V] [TRT] Tactic: 0x0000000000000000 Time: 0.00912543
[06/28/2024-09:33:51] [V] [TRT] Fastest Tactic: 0x00000000000003e8 Time: 0.00868464
[06/28/2024-09:33:51] [V] [TRT] *************** Autotuning Reformat: Float(1,256,1) -> Int8(102400:4,256,1) ***************
[06/28/2024-09:33:51] [V] [TRT] --------------- Timing Runner: Optimizer Reformat(Reformatted query -> <out>) (Reformat)
[06/28/2024-09:33:51] [V] [TRT] Setting a default quantization params because quantization data is missing for 
[06/28/2024-09:33:51] [V] [TRT] Tactic: 0x00000000000003e8 Time: 0.011827
[06/28/2024-09:33:51] [V] [TRT] Setting a default quantization params because quantization data is missing for 
[06/28/2024-09:33:51] [V] [TRT] Tactic: 0x00000000000003ea Time: 0.00810108
[06/28/2024-09:33:51] [V] [TRT] Setting a default quantization params because quantization data is missing for 
[06/28/2024-09:33:51] [V] [TRT] Tactic: 0x0000000000000000 Time: 0.0100861
[06/28/2024-09:33:51] [V] [TRT] Fastest Tactic: 0x00000000000003ea Time: 0.00810108
[06/28/2024-09:33:51] [V] [TRT] *************** Autotuning Reformat: Float(1,256,1) -> Int8(102400:32,256,1) ***************
[06/28/2024-09:33:51] [V] [TRT] --------------- Timing Runner: Optimizer Reformat(Reformatted query -> <out>) (Reformat)
[06/28/2024-09:33:51] [V] [TRT] Setting a default quantization params because quantization data is missing for 
[06/28/2024-09:33:51] [V] [TRT] Tactic: 0x00000000000003e8 Time: 0.140158
[06/28/2024-09:33:51] [V] [TRT] Setting a default quantization params because quantization data is missing for 
[06/28/2024-09:33:51] [V] [TRT] Tactic: 0x00000000000003ea Time: 0.0309797
[06/28/2024-09:33:51] [V] [TRT] Setting a default quantization params because quantization data is missing for 
[06/28/2024-09:33:51] [V] [TRT] Tactic: 0x0000000000000000 Time: 0.208896
[06/28/2024-09:33:51] [V] [TRT] Fastest Tactic: 0x00000000000003ea Time: 0.0309797
[06/28/2024-09:33:51] [V] [TRT] *************** Autotuning Reformat: Float(1:4,256,1) -> Float(102400,256,1) ***************
[06/28/2024-09:33:51] [V] [TRT] --------------- Timing Runner: Optimizer Reformat(Reformatted query -> <out>) (Reformat)
[06/28/2024-09:33:51] [V] [TRT] Setting a default quantization params because quantization data is missing for 
[06/28/2024-09:33:51] [V] [TRT] Tactic: 0x00000000000003e8 Time: 0.00613524
[06/28/2024-09:33:51] [V] [TRT] Setting a default quantization params because quantization data is missing for 
[06/28/2024-09:33:51] [V] [TRT] Tactic: 0x00000000000003ea Time: 0.0804731
[06/28/2024-09:33:51] [V] [TRT] Setting a default quantization params because quantization data is missing for 
[06/28/2024-09:33:51] [V] [TRT] Tactic: 0x0000000000000000 Time: 0.00596267
[06/28/2024-09:33:51] [V] [TRT] Fastest Tactic: 0x0000000000000000 Time: 0.00596267
[06/28/2024-09:33:51] [V] [TRT] *************** Autotuning Reformat: Float(1:4,256,1) -> Float(1,256,1) ***************
[06/28/2024-09:33:51] [V] [TRT] --------------- Timing Runner: Optimizer Reformat(Reformatted query -> <out>) (Reformat)
[06/28/2024-09:33:51] [V] [TRT] Setting a default quantization params because quantization data is missing for 
[06/28/2024-09:33:51] [V] [TRT] Tactic: 0x00000000000003e8 Time: 0.00531331
[06/28/2024-09:33:51] [V] [TRT] Setting a default quantization params because quantization data is missing for 
[06/28/2024-09:33:51] [V] [TRT] Tactic: 0x00000000000003ea Time: 0.455534
[06/28/2024-09:33:51] [V] [TRT] Setting a default quantization params because quantization data is missing for 
[06/28/2024-09:33:51] [V] [TRT] Tactic: 0x0000000000000000 Time: 0.00487801
[06/28/2024-09:33:51] [V] [TRT] Fastest Tactic: 0x0000000000000000 Time: 0.00487801
[06/28/2024-09:33:51] [V] [TRT] *************** Autotuning Reformat: Float(1:4,256,1) -> Float(102400:32,256,1) ***************
[06/28/2024-09:33:51] [V] [TRT] --------------- Timing Runner: Optimizer Reformat(Reformatted query -> <out>) (Reformat)
[06/28/2024-09:33:51] [V] [TRT] Setting a default quantization params because quantization data is missing for 
[06/28/2024-09:33:51] [V] [TRT] Tactic: 0x00000000000003e8 Time: 1.03044
[06/28/2024-09:33:51] [V] [TRT] Setting a default quantization params because quantization data is missing for 
[06/28/2024-09:33:51] [V] [TRT] Tactic: 0x00000000000003ea Time: 0.0797989
[06/28/2024-09:33:51] [V] [TRT] Setting a default quantization params because quantization data is missing for 
[06/28/2024-09:33:51] [V] [TRT] Tactic: 0x0000000000000000 Time: 0.930816
[06/28/2024-09:33:51] [V] [TRT] Fastest Tactic: 0x00000000000003ea Time: 0.0797989
[06/28/2024-09:33:51] [V] [TRT] *************** Autotuning Reformat: Float(1:4,256,1) -> Half(102400,256,1) ***************
[06/28/2024-09:33:51] [V] [TRT] --------------- Timing Runner: Optimizer Reformat(Reformatted query -> <out>) (Reformat)
[06/28/2024-09:33:51] [V] [TRT] Setting a default quantization params because quantization data is missing for 
[06/28/2024-09:33:51] [V] [TRT] Tactic: 0x00000000000003e8 Time: 0.0189536
[06/28/2024-09:33:51] [V] [TRT] Setting a default quantization params because quantization data is missing for 
[06/28/2024-09:33:51] [V] [TRT] Tactic: 0x00000000000003ea Time: 0.0333824
[06/28/2024-09:33:51] [V] [TRT] Setting a default quantization params because quantization data is missing for 
[06/28/2024-09:33:51] [V] [TRT] Tactic: 0x0000000000000000 Time: 0.00586331
[06/28/2024-09:33:51] [V] [TRT] Fastest Tactic: 0x0000000000000000 Time: 0.00586331
[06/28/2024-09:33:51] [V] [TRT] *************** Autotuning Reformat: Float(1:4,256,1) -> Half(102400:2,256,1) ***************
[06/28/2024-09:33:51] [V] [TRT] --------------- Timing Runner: Optimizer Reformat(Reformatted query -> <out>) (Reformat)
[06/28/2024-09:33:51] [V] [TRT] Setting a default quantization params because quantization data is missing for 
[06/28/2024-09:33:51] [V] [TRT] Tactic: 0x00000000000003e8 Time: 0.00767182
[06/28/2024-09:33:51] [V] [TRT] Setting a default quantization params because quantization data is missing for 
[06/28/2024-09:33:51] [V] [TRT] Tactic: 0x00000000000003ea Time: 0.00809168
[06/28/2024-09:33:51] [V] [TRT] Setting a default quantization params because quantization data is missing for 
[06/28/2024-09:33:51] [V] [TRT] Tactic: 0x0000000000000000 Time: 0.00825981
[06/28/2024-09:33:51] [V] [TRT] Fastest Tactic: 0x00000000000003e8 Time: 0.00767182
[06/28/2024-09:33:51] [V] [TRT] *************** Autotuning Reformat: Float(1:4,256,1) -> Half(1:4,256,1) ***************
[06/28/2024-09:33:51] [V] [TRT] --------------- Timing Runner: Optimizer Reformat(Reformatted query -> <out>) (Reformat)
[06/28/2024-09:33:51] [V] [TRT] Setting a default quantization params because quantization data is missing for 
[06/28/2024-09:33:51] [V] [TRT] Tactic: 0x00000000000003e8 Time: 0.00945371
[06/28/2024-09:33:51] [V] [TRT] Setting a default quantization params because quantization data is missing for 
[06/28/2024-09:33:51] [V] [TRT] Tactic: 0x00000000000003ea Time: 0.00803733
[06/28/2024-09:33:51] [V] [TRT] Setting a default quantization params because quantization data is missing for 
[06/28/2024-09:33:51] [V] [TRT] Tactic: 0x0000000000000000 Time: 0.00963688
[06/28/2024-09:33:51] [V] [TRT] Fastest Tactic: 0x00000000000003ea Time: 0.00803733
[06/28/2024-09:33:51] [V] [TRT] *************** Autotuning Reformat: Float(1:4,256,1) -> Half(1:8,256,1) ***************
[06/28/2024-09:33:51] [V] [TRT] --------------- Timing Runner: Optimizer Reformat(Reformatted query -> <out>) (Reformat)
[06/28/2024-09:33:51] [V] [TRT] Setting a default quantization params because quantization data is missing for 
[06/28/2024-09:33:51] [V] [TRT] Tactic: 0x00000000000003e8 Time: 0.0153161
[06/28/2024-09:33:51] [V] [TRT] Setting a default quantization params because quantization data is missing for 
[06/28/2024-09:33:51] [V] [TRT] Tactic: 0x00000000000003ea Time: 0.0341742
[06/28/2024-09:33:51] [V] [TRT] Setting a default quantization params because quantization data is missing for 
[06/28/2024-09:33:51] [V] [TRT] Tactic: 0x0000000000000000 Time: 0.0155502
[06/28/2024-09:33:51] [V] [TRT] Fastest Tactic: 0x00000000000003e8 Time: 0.0153161
[06/28/2024-09:33:51] [V] [TRT] *************** Autotuning Reformat: Float(1:4,256,1) -> Half(1:16,256,1) ***************
[06/28/2024-09:33:51] [V] [TRT] --------------- Timing Runner: Optimizer Reformat(Reformatted query -> <out>) (Reformat)
[06/28/2024-09:33:51] [V] [TRT] Setting a default quantization params because quantization data is missing for 
[06/28/2024-09:33:51] [V] [TRT] Tactic: 0x00000000000003e8 Time: 0.0293157
[06/28/2024-09:33:51] [V] [TRT] Setting a default quantization params because quantization data is missing for 
[06/28/2024-09:33:51] [V] [TRT] Tactic: 0x00000000000003ea Time: 0.0341714
[06/28/2024-09:33:51] [V] [TRT] Setting a default quantization params because quantization data is missing for 
[06/28/2024-09:33:51] [V] [TRT] Tactic: 0x0000000000000000 Time: 0.0293449
[06/28/2024-09:33:51] [V] [TRT] Fastest Tactic: 0x00000000000003e8 Time: 0.0293157
[06/28/2024-09:33:51] [V] [TRT] *************** Autotuning Reformat: Float(1:4,256,1) -> Half(102400:32,256,1) ***************
[06/28/2024-09:33:51] [V] [TRT] --------------- Timing Runner: Optimizer Reformat(Reformatted query -> <out>) (Reformat)
[06/28/2024-09:33:51] [V] [TRT] Setting a default quantization params because quantization data is missing for 
[06/28/2024-09:33:51] [V] [TRT] Tactic: 0x00000000000003e8 Time: 0.325047
[06/28/2024-09:33:51] [V] [TRT] Setting a default quantization params because quantization data is missing for 
[06/28/2024-09:33:51] [V] [TRT] Tactic: 0x00000000000003ea Time: 0.027501
[06/28/2024-09:33:51] [V] [TRT] Setting a default quantization params because quantization data is missing for 
[06/28/2024-09:33:51] [V] [TRT] Tactic: 0x0000000000000000 Time: 0.457289
[06/28/2024-09:33:51] [V] [TRT] Fastest Tactic: 0x00000000000003ea Time: 0.027501
[06/28/2024-09:33:51] [V] [TRT] *************** Autotuning Reformat: Float(1:4,256,1) -> Int8(102400,256,1) ***************
[06/28/2024-09:33:51] [V] [TRT] --------------- Timing Runner: Optimizer Reformat(Reformatted query -> <out>) (Reformat)
[06/28/2024-09:33:51] [V] [TRT] Setting a default quantization params because quantization data is missing for 
[06/28/2024-09:33:51] [V] [TRT] Tactic: 0x00000000000003e8 Time: 0.00574136
[06/28/2024-09:33:51] [V] [TRT] Setting a default quantization params because quantization data is missing for 
[06/28/2024-09:33:51] [V] [TRT] Tactic: 0x00000000000003ea Time: 0.0590994
[06/28/2024-09:33:51] [V] [TRT] Setting a default quantization params because quantization data is missing for 
[06/28/2024-09:33:51] [V] [TRT] Tactic: 0x0000000000000000 Time: 0.00583461
[06/28/2024-09:33:51] [V] [TRT] Fastest Tactic: 0x00000000000003e8 Time: 0.00574136
[06/28/2024-09:33:51] [V] [TRT] *************** Autotuning Reformat: Float(1:4,256,1) -> Int8(102400:4,256,1) ***************
[06/28/2024-09:33:51] [V] [TRT] --------------- Timing Runner: Optimizer Reformat(Reformatted query -> <out>) (Reformat)
[06/28/2024-09:33:51] [V] [TRT] Setting a default quantization params because quantization data is missing for 
[06/28/2024-09:33:51] [V] [TRT] Tactic: 0x00000000000003e8 Time: 0.00928
[06/28/2024-09:33:51] [V] [TRT] Setting a default quantization params because quantization data is missing for 
[06/28/2024-09:33:51] [V] [TRT] Tactic: 0x00000000000003ea Time: 0.00888013
[06/28/2024-09:33:51] [V] [TRT] Setting a default quantization params because quantization data is missing for 
[06/28/2024-09:33:51] [V] [TRT] Tactic: 0x0000000000000000 Time: 0.00953844
[06/28/2024-09:33:51] [V] [TRT] Fastest Tactic: 0x00000000000003ea Time: 0.00888013
[06/28/2024-09:33:51] [V] [TRT] *************** Autotuning Reformat: Float(1:4,256,1) -> Int8(102400:32,256,1) ***************
[06/28/2024-09:33:51] [V] [TRT] --------------- Timing Runner: Optimizer Reformat(Reformatted query -> <out>) (Reformat)
[06/28/2024-09:33:51] [V] [TRT] Setting a default quantization params because quantization data is missing for 
[06/28/2024-09:33:51] [V] [TRT] Tactic: 0x00000000000003e8 Time: 0.140361
[06/28/2024-09:33:51] [V] [TRT] Setting a default quantization params because quantization data is missing for 
[06/28/2024-09:33:51] [V] [TRT] Tactic: 0x00000000000003ea Time: 0.0339968
[06/28/2024-09:33:51] [V] [TRT] Setting a default quantization params because quantization data is missing for 
[06/28/2024-09:33:51] [V] [TRT] Tactic: 0x0000000000000000 Time: 0.293742
[06/28/2024-09:33:51] [V] [TRT] Fastest Tactic: 0x00000000000003ea Time: 0.0339968
[06/28/2024-09:33:51] [V] [TRT] *************** Autotuning Reformat: Float(102400:32,256,1) -> Float(102400,256,1) ***************
[06/28/2024-09:33:51] [V] [TRT] --------------- Timing Runner: Optimizer Reformat(Reformatted query -> <out>) (Reformat)
[06/28/2024-09:33:51] [V] [TRT] Setting a default quantization params because quantization data is missing for 
[06/28/2024-09:33:51] [V] [TRT] Tactic: 0x00000000000003e8 Time: 0.00655046
[06/28/2024-09:33:51] [V] [TRT] Setting a default quantization params because quantization data is missing for 
[06/28/2024-09:33:51] [V] [TRT] Tactic: 0x00000000000003ea Time: 0.0805303
[06/28/2024-09:33:51] [V] [TRT] Setting a default quantization params because quantization data is missing for 
[06/28/2024-09:33:51] [V] [TRT] Tactic: 0x0000000000000000 Time: 0.0119128
[06/28/2024-09:33:51] [V] [TRT] Fastest Tactic: 0x00000000000003e8 Time: 0.00655046
[06/28/2024-09:33:51] [V] [TRT] *************** Autotuning Reformat: Float(102400:32,256,1) -> Float(1,256,1) ***************
[06/28/2024-09:33:51] [V] [TRT] --------------- Timing Runner: Optimizer Reformat(Reformatted query -> <out>) (Reformat)
[06/28/2024-09:33:51] [V] [TRT] Setting a default quantization params because quantization data is missing for 
[06/28/2024-09:33:51] [V] [TRT] Tactic: 0x00000000000003e8 Time: 0.0106279
[06/28/2024-09:33:51] [V] [TRT] Setting a default quantization params because quantization data is missing for 
[06/28/2024-09:33:51] [V] [TRT] Tactic: 0x00000000000003ea Time: 0.455506
[06/28/2024-09:33:51] [V] [TRT] Setting a default quantization params because quantization data is missing for 
[06/28/2024-09:33:51] [V] [TRT] Tactic: 0x0000000000000000 Time: 0.0107961
[06/28/2024-09:33:51] [V] [TRT] Fastest Tactic: 0x00000000000003e8 Time: 0.0106279
[06/28/2024-09:33:51] [V] [TRT] *************** Autotuning Reformat: Float(102400:32,256,1) -> Float(1:4,256,1) ***************
[06/28/2024-09:33:51] [V] [TRT] --------------- Timing Runner: Optimizer Reformat(Reformatted query -> <out>) (Reformat)
[06/28/2024-09:33:51] [V] [TRT] Setting a default quantization params because quantization data is missing for 
[06/28/2024-09:33:51] [V] [TRT] Tactic: 0x00000000000003e8 Time: 0.0150821
[06/28/2024-09:33:51] [V] [TRT] Setting a default quantization params because quantization data is missing for 
[06/28/2024-09:33:51] [V] [TRT] Tactic: 0x00000000000003ea Time: 0.0797989
[06/28/2024-09:33:51] [V] [TRT] Setting a default quantization params because quantization data is missing for 
[06/28/2024-09:33:51] [V] [TRT] Tactic: 0x0000000000000000 Time: 0.0121874
[06/28/2024-09:33:51] [V] [TRT] Fastest Tactic: 0x0000000000000000 Time: 0.0121874
[06/28/2024-09:33:51] [V] [TRT] *************** Autotuning Reformat: Float(102400:32,256,1) -> Half(102400,256,1) ***************
[06/28/2024-09:33:51] [V] [TRT] --------------- Timing Runner: Optimizer Reformat(Reformatted query -> <out>) (Reformat)
[06/28/2024-09:33:51] [V] [TRT] Setting a default quantization params because quantization data is missing for 
[06/28/2024-09:33:51] [V] [TRT] Tactic: 0x00000000000003e8 Time: 0.00766773
[06/28/2024-09:33:51] [V] [TRT] Setting a default quantization params because quantization data is missing for 
[06/28/2024-09:33:51] [V] [TRT] Tactic: 0x00000000000003ea Time: 0.0336457
[06/28/2024-09:33:51] [V] [TRT] Setting a default quantization params because quantization data is missing for 
[06/28/2024-09:33:51] [V] [TRT] Tactic: 0x0000000000000000 Time: 0.00844343
[06/28/2024-09:33:51] [V] [TRT] Fastest Tactic: 0x00000000000003e8 Time: 0.00766773
[06/28/2024-09:33:51] [V] [TRT] *************** Autotuning Reformat: Float(102400:32,256,1) -> Half(102400:2,256,1) ***************
[06/28/2024-09:33:51] [V] [TRT] --------------- Timing Runner: Optimizer Reformat(Reformatted query -> <out>) (Reformat)
[06/28/2024-09:33:51] [V] [TRT] Setting a default quantization params because quantization data is missing for 
[06/28/2024-09:33:51] [V] [TRT] Tactic: 0x00000000000003e8 Time: 0.00864672
[06/28/2024-09:33:51] [V] [TRT] Setting a default quantization params because quantization data is missing for 
[06/28/2024-09:33:51] [V] [TRT] Tactic: 0x00000000000003ea Time: 0.00874971
[06/28/2024-09:33:51] [V] [TRT] Setting a default quantization params because quantization data is missing for 
[06/28/2024-09:33:51] [V] [TRT] Tactic: 0x0000000000000000 Time: 0.0127768
[06/28/2024-09:33:51] [V] [TRT] Fastest Tactic: 0x00000000000003e8 Time: 0.00864672
[06/28/2024-09:33:51] [V] [TRT] *************** Autotuning Reformat: Float(102400:32,256,1) -> Half(1:4,256,1) ***************
[06/28/2024-09:33:51] [V] [TRT] --------------- Timing Runner: Optimizer Reformat(Reformatted query -> <out>) (Reformat)
[06/28/2024-09:33:51] [V] [TRT] Setting a default quantization params because quantization data is missing for 
[06/28/2024-09:33:51] [V] [TRT] Tactic: 0x00000000000003e8 Time: 0.010721
[06/28/2024-09:33:51] [V] [TRT] Setting a default quantization params because quantization data is missing for 
[06/28/2024-09:33:51] [V] [TRT] Tactic: 0x00000000000003ea Time: 0.00799238
[06/28/2024-09:33:51] [V] [TRT] Setting a default quantization params because quantization data is missing for 
[06/28/2024-09:33:51] [V] [TRT] Tactic: 0x0000000000000000 Time: 0.0107275
[06/28/2024-09:33:51] [V] [TRT] Fastest Tactic: 0x00000000000003ea Time: 0.00799238
[06/28/2024-09:33:51] [V] [TRT] *************** Autotuning Reformat: Float(102400:32,256,1) -> Half(1:8,256,1) ***************
[06/28/2024-09:33:51] [V] [TRT] --------------- Timing Runner: Optimizer Reformat(Reformatted query -> <out>) (Reformat)
[06/28/2024-09:33:51] [V] [TRT] Setting a default quantization params because quantization data is missing for 
[06/28/2024-09:33:51] [V] [TRT] Tactic: 0x00000000000003e8 Time: 0.0169691
[06/28/2024-09:33:51] [V] [TRT] Setting a default quantization params because quantization data is missing for 
[06/28/2024-09:33:51] [V] [TRT] Tactic: 0x00000000000003ea Time: 0.0341723
[06/28/2024-09:33:51] [V] [TRT] Setting a default quantization params because quantization data is missing for 
[06/28/2024-09:33:51] [V] [TRT] Tactic: 0x0000000000000000 Time: 0.0170204
[06/28/2024-09:33:51] [V] [TRT] Fastest Tactic: 0x00000000000003e8 Time: 0.0169691
[06/28/2024-09:33:51] [V] [TRT] *************** Autotuning Reformat: Float(102400:32,256,1) -> Half(1:16,256,1) ***************
[06/28/2024-09:33:51] [V] [TRT] --------------- Timing Runner: Optimizer Reformat(Reformatted query -> <out>) (Reformat)
[06/28/2024-09:33:51] [V] [TRT] Setting a default quantization params because quantization data is missing for 
[06/28/2024-09:33:51] [V] [TRT] Tactic: 0x00000000000003e8 Time: 0.0310418
[06/28/2024-09:33:51] [V] [TRT] Setting a default quantization params because quantization data is missing for 
[06/28/2024-09:33:51] [V] [TRT] Tactic: 0x00000000000003ea Time: 0.0341989
[06/28/2024-09:33:51] [V] [TRT] Setting a default quantization params because quantization data is missing for 
[06/28/2024-09:33:51] [V] [TRT] Tactic: 0x0000000000000000 Time: 0.0310135
[06/28/2024-09:33:51] [V] [TRT] Fastest Tactic: 0x0000000000000000 Time: 0.0310135
[06/28/2024-09:33:51] [V] [TRT] *************** Autotuning Reformat: Float(102400:32,256,1) -> Half(102400:32,256,1) ***************
[06/28/2024-09:33:51] [V] [TRT] --------------- Timing Runner: Optimizer Reformat(Reformatted query -> <out>) (Reformat)
[06/28/2024-09:33:51] [V] [TRT] Setting a default quantization params because quantization data is missing for 
[06/28/2024-09:33:51] [V] [TRT] Tactic: 0x00000000000003e8 Time: 0.487424
[06/28/2024-09:33:51] [V] [TRT] Setting a default quantization params because quantization data is missing for 
[06/28/2024-09:33:51] [V] [TRT] Tactic: 0x00000000000003ea Time: 0.0275558
[06/28/2024-09:33:51] [V] [TRT] Setting a default quantization params because quantization data is missing for 
[06/28/2024-09:33:51] [V] [TRT] Tactic: 0x0000000000000000 Time: 0.32651
[06/28/2024-09:33:51] [V] [TRT] Fastest Tactic: 0x00000000000003ea Time: 0.0275558
[06/28/2024-09:33:51] [V] [TRT] *************** Autotuning Reformat: Float(102400:32,256,1) -> Int8(102400,256,1) ***************
[06/28/2024-09:33:51] [V] [TRT] --------------- Timing Runner: Optimizer Reformat(Reformatted query -> <out>) (Reformat)
[06/28/2024-09:33:51] [V] [TRT] Setting a default quantization params because quantization data is missing for 
[06/28/2024-09:33:51] [V] [TRT] Tactic: 0x00000000000003e8 Time: 0.0109218
[06/28/2024-09:33:51] [V] [TRT] Setting a default quantization params because quantization data is missing for 
[06/28/2024-09:33:51] [V] [TRT] Tactic: 0x00000000000003ea Time: 0.0591421
[06/28/2024-09:33:51] [V] [TRT] Setting a default quantization params because quantization data is missing for 
[06/28/2024-09:33:51] [V] [TRT] Tactic: 0x0000000000000000 Time: 0.0108924
[06/28/2024-09:33:51] [V] [TRT] Fastest Tactic: 0x0000000000000000 Time: 0.0108924
[06/28/2024-09:33:51] [V] [TRT] *************** Autotuning Reformat: Float(102400:32,256,1) -> Int8(102400:4,256,1) ***************
[06/28/2024-09:33:51] [V] [TRT] --------------- Timing Runner: Optimizer Reformat(Reformatted query -> <out>) (Reformat)
[06/28/2024-09:33:51] [V] [TRT] Setting a default quantization params because quantization data is missing for 
[06/28/2024-09:33:51] [V] [TRT] Tactic: 0x00000000000003e8 Time: 0.0125215
[06/28/2024-09:33:51] [V] [TRT] Setting a default quantization params because quantization data is missing for 
[06/28/2024-09:33:51] [V] [TRT] Tactic: 0x00000000000003ea Time: 0.0368686
[06/28/2024-09:33:51] [V] [TRT] Setting a default quantization params because quantization data is missing for 
[06/28/2024-09:33:51] [V] [TRT] Tactic: 0x0000000000000000 Time: 0.0101531
[06/28/2024-09:33:51] [V] [TRT] Fastest Tactic: 0x0000000000000000 Time: 0.0101531
[06/28/2024-09:33:51] [V] [TRT] *************** Autotuning Reformat: Float(102400:32,256,1) -> Int8(102400:32,256,1) ***************
[06/28/2024-09:33:51] [V] [TRT] --------------- Timing Runner: Optimizer Reformat(Reformatted query -> <out>) (Reformat)
[06/28/2024-09:33:51] [V] [TRT] Setting a default quantization params because quantization data is missing for 
[06/28/2024-09:33:51] [V] [TRT] Tactic: 0x00000000000003e8 Time: 0.141897
[06/28/2024-09:33:51] [V] [TRT] Setting a default quantization params because quantization data is missing for 
[06/28/2024-09:33:51] [V] [TRT] Tactic: 0x00000000000003ea Time: 0.034816
[06/28/2024-09:33:51] [V] [TRT] Setting a default quantization params because quantization data is missing for 
[06/28/2024-09:33:51] [V] [TRT] Tactic: 0x0000000000000000 Time: 0.14197
[06/28/2024-09:33:51] [V] [TRT] Fastest Tactic: 0x00000000000003ea Time: 0.034816
[06/28/2024-09:33:51] [V] [TRT] *************** Autotuning Reformat: Half(102400,256,1) -> Float(102400,256,1) ***************
[06/28/2024-09:33:51] [V] [TRT] --------------- Timing Runner: Optimizer Reformat(Reformatted query -> <out>) (Reformat)
[06/28/2024-09:33:51] [V] [TRT] Setting a default quantization params because quantization data is missing for 
[06/28/2024-09:33:51] [V] [TRT] Tactic: 0x00000000000003e8 Time: 0.00413649
[06/28/2024-09:33:51] [V] [TRT] Setting a default quantization params because quantization data is missing for 
[06/28/2024-09:33:51] [V] [TRT] Tactic: 0x00000000000003ea Time: 0.00649455
[06/28/2024-09:33:51] [V] [TRT] Setting a default quantization params because quantization data is missing for 
[06/28/2024-09:33:51] [V] [TRT] Tactic: 0x0000000000000000 Time: 0.00556325
[06/28/2024-09:33:51] [V] [TRT] Fastest Tactic: 0x00000000000003e8 Time: 0.00413649
[06/28/2024-09:33:51] [V] [TRT] *************** Autotuning Reformat: Half(102400,256,1) -> Float(1,256,1) ***************
[06/28/2024-09:33:51] [V] [TRT] --------------- Timing Runner: Optimizer Reformat(Reformatted query -> <out>) (Reformat)
[06/28/2024-09:33:51] [V] [TRT] Setting a default quantization params because quantization data is missing for 
[06/28/2024-09:33:51] [V] [TRT] Tactic: 0x00000000000003e8 Time: 0.0052338
[06/28/2024-09:33:51] [V] [TRT] Setting a default quantization params because quantization data is missing for 
[06/28/2024-09:33:51] [V] [TRT] Tactic: 0x00000000000003ea Time: 1.17628
[06/28/2024-09:33:51] [V] [TRT] Setting a default quantization params because quantization data is missing for 
[06/28/2024-09:33:51] [V] [TRT] Tactic: 0x0000000000000000 Time: 0.00894829
[06/28/2024-09:33:51] [V] [TRT] Fastest Tactic: 0x00000000000003e8 Time: 0.0052338
[06/28/2024-09:33:51] [V] [TRT] *************** Autotuning Reformat: Half(102400,256,1) -> Float(1:4,256,1) ***************
[06/28/2024-09:33:51] [V] [TRT] --------------- Timing Runner: Optimizer Reformat(Reformatted query -> <out>) (Reformat)
[06/28/2024-09:33:51] [V] [TRT] Setting a default quantization params because quantization data is missing for 
[06/28/2024-09:33:51] [V] [TRT] Tactic: 0x00000000000003e8 Time: 0.0134974
[06/28/2024-09:33:51] [V] [TRT] Setting a default quantization params because quantization data is missing for 
[06/28/2024-09:33:51] [V] [TRT] Tactic: 0x00000000000003ea Time: 0.0324206
[06/28/2024-09:33:51] [V] [TRT] Setting a default quantization params because quantization data is missing for 
[06/28/2024-09:33:51] [V] [TRT] Tactic: 0x0000000000000000 Time: 0.0104186
[06/28/2024-09:33:51] [V] [TRT] Fastest Tactic: 0x0000000000000000 Time: 0.0104186
[06/28/2024-09:33:51] [V] [TRT] *************** Autotuning Reformat: Half(102400,256,1) -> Float(102400:32,256,1) ***************
[06/28/2024-09:33:51] [V] [TRT] --------------- Timing Runner: Optimizer Reformat(Reformatted query -> <out>) (Reformat)
[06/28/2024-09:33:51] [V] [TRT] Setting a default quantization params because quantization data is missing for 
[06/28/2024-09:33:51] [V] [TRT] Tactic: 0x00000000000003e8 Time: 0.942519
[06/28/2024-09:33:51] [V] [TRT] Setting a default quantization params because quantization data is missing for 
[06/28/2024-09:33:51] [V] [TRT] Tactic: 0x00000000000003ea Time: 0.0266522
[06/28/2024-09:33:51] [V] [TRT] Setting a default quantization params because quantization data is missing for 
[06/28/2024-09:33:51] [V] [TRT] Tactic: 0x0000000000000000 Time: 1.06832
[06/28/2024-09:33:51] [V] [TRT] Fastest Tactic: 0x00000000000003ea Time: 0.0266522
[06/28/2024-09:33:51] [V] [TRT] *************** Autotuning Reformat: Half(102400,256,1) -> Half(102400:2,256,1) ***************
[06/28/2024-09:33:51] [V] [TRT] --------------- Timing Runner: Optimizer Reformat(Reformatted query -> <out>) (Reformat)
[06/28/2024-09:33:51] [V] [TRT] Setting a default quantization params because quantization data is missing for 
[06/28/2024-09:33:51] [V] [TRT] Tactic: 0x00000000000003e8 Time: 0.00738469
[06/28/2024-09:33:51] [V] [TRT] Setting a default quantization params because quantization data is missing for 
[06/28/2024-09:33:51] [V] [TRT] Tactic: 0x00000000000003ea Time: 0.00858819
[06/28/2024-09:33:51] [V] [TRT] Setting a default quantization params because quantization data is missing for 
[06/28/2024-09:33:51] [V] [TRT] Tactic: 0x0000000000000000 Time: 0.00814171
[06/28/2024-09:33:51] [V] [TRT] Fastest Tactic: 0x00000000000003e8 Time: 0.00738469
[06/28/2024-09:33:51] [V] [TRT] *************** Autotuning Reformat: Half(102400,256,1) -> Half(1:4,256,1) ***************
[06/28/2024-09:33:51] [V] [TRT] --------------- Timing Runner: Optimizer Reformat(Reformatted query -> <out>) (Reformat)
[06/28/2024-09:33:51] [V] [TRT] Setting a default quantization params because quantization data is missing for 
[06/28/2024-09:33:51] [V] [TRT] Tactic: 0x00000000000003e8 Time: 0.00917
[06/28/2024-09:33:51] [V] [TRT] Setting a default quantization params because quantization data is missing for 
[06/28/2024-09:33:51] [V] [TRT] Tactic: 0x00000000000003ea Time: 0.0104872
[06/28/2024-09:33:51] [V] [TRT] Setting a default quantization params because quantization data is missing for 
[06/28/2024-09:33:51] [V] [TRT] Tactic: 0x0000000000000000 Time: 0.00786214
[06/28/2024-09:33:51] [V] [TRT] Fastest Tactic: 0x0000000000000000 Time: 0.00786214
[06/28/2024-09:33:51] [V] [TRT] *************** Autotuning Reformat: Half(102400,256,1) -> Half(1:8,256,1) ***************
[06/28/2024-09:33:51] [V] [TRT] --------------- Timing Runner: Optimizer Reformat(Reformatted query -> <out>) (Reformat)
[06/28/2024-09:33:51] [V] [TRT] Setting a default quantization params because quantization data is missing for 
[06/28/2024-09:33:51] [V] [TRT] Tactic: 0x00000000000003e8 Time: 0.0149367
[06/28/2024-09:33:51] [V] [TRT] Setting a default quantization params because quantization data is missing for 
[06/28/2024-09:33:51] [V] [TRT] Tactic: 0x00000000000003ea Time: 0.00944457
[06/28/2024-09:33:51] [V] [TRT] Setting a default quantization params because quantization data is missing for 
[06/28/2024-09:33:51] [V] [TRT] Tactic: 0x0000000000000000 Time: 0.00783543
[06/28/2024-09:33:51] [V] [TRT] Fastest Tactic: 0x0000000000000000 Time: 0.00783543
[06/28/2024-09:33:51] [V] [TRT] *************** Autotuning Reformat: Half(102400,256,1) -> Half(1:16,256,1) ***************
[06/28/2024-09:33:51] [V] [TRT] --------------- Timing Runner: Optimizer Reformat(Reformatted query -> <out>) (Reformat)
[06/28/2024-09:33:51] [V] [TRT] Setting a default quantization params because quantization data is missing for 
[06/28/2024-09:33:51] [V] [TRT] Tactic: 0x00000000000003e8 Time: 0.0290606
[06/28/2024-09:33:51] [V] [TRT] Setting a default quantization params because quantization data is missing for 
[06/28/2024-09:33:51] [V] [TRT] Tactic: 0x00000000000003ea Time: 0.0143781
[06/28/2024-09:33:51] [V] [TRT] Setting a default quantization params because quantization data is missing for 
[06/28/2024-09:33:51] [V] [TRT] Tactic: 0x0000000000000000 Time: 0.0291109
[06/28/2024-09:33:51] [V] [TRT] Fastest Tactic: 0x00000000000003ea Time: 0.0143781
[06/28/2024-09:33:51] [V] [TRT] *************** Autotuning Reformat: Half(102400,256,1) -> Half(102400:32,256,1) ***************
[06/28/2024-09:33:51] [V] [TRT] --------------- Timing Runner: Optimizer Reformat(Reformatted query -> <out>) (Reformat)
[06/28/2024-09:33:51] [V] [TRT] Setting a default quantization params because quantization data is missing for 
[06/28/2024-09:33:51] [V] [TRT] Tactic: 0x00000000000003e8 Time: 0.324599
[06/28/2024-09:33:51] [V] [TRT] Setting a default quantization params because quantization data is missing for 
[06/28/2024-09:33:51] [V] [TRT] Tactic: 0x00000000000003ea Time: 0.0230922
[06/28/2024-09:33:51] [V] [TRT] Setting a default quantization params because quantization data is missing for 
[06/28/2024-09:33:51] [V] [TRT] Tactic: 0x0000000000000000 Time: 0.324462
[06/28/2024-09:33:51] [V] [TRT] Fastest Tactic: 0x00000000000003ea Time: 0.0230922
[06/28/2024-09:33:51] [V] [TRT] *************** Autotuning Reformat: Half(102400,256,1) -> Int8(102400,256,1) ***************
[06/28/2024-09:33:51] [V] [TRT] --------------- Timing Runner: Optimizer Reformat(Reformatted query -> <out>) (Reformat)
[06/28/2024-09:33:51] [V] [TRT] Setting a default quantization params because quantization data is missing for 
[06/28/2024-09:33:51] [V] [TRT] Tactic: 0x00000000000003e8 Time: 0.00530939
[06/28/2024-09:33:51] [V] [TRT] Setting a default quantization params because quantization data is missing for 
[06/28/2024-09:33:51] [V] [TRT] Tactic: 0x00000000000003ea Time: 0.013536
[06/28/2024-09:33:51] [V] [TRT] Setting a default quantization params because quantization data is missing for 
[06/28/2024-09:33:51] [V] [TRT] Tactic: 0x0000000000000000 Time: 0.00479208
[06/28/2024-09:33:51] [V] [TRT] Fastest Tactic: 0x0000000000000000 Time: 0.00479208
[06/28/2024-09:33:51] [V] [TRT] *************** Autotuning Reformat: Half(102400,256,1) -> Int8(102400:4,256,1) ***************
[06/28/2024-09:33:51] [V] [TRT] --------------- Timing Runner: Optimizer Reformat(Reformatted query -> <out>) (Reformat)
[06/28/2024-09:33:51] [V] [TRT] Setting a default quantization params because quantization data is missing for 
[06/28/2024-09:33:51] [V] [TRT] Tactic: 0x00000000000003e8 Time: 0.0096
[06/28/2024-09:33:51] [V] [TRT] Setting a default quantization params because quantization data is missing for 
[06/28/2024-09:33:51] [V] [TRT] Tactic: 0x00000000000003ea Time: 0.00764006
[06/28/2024-09:33:51] [V] [TRT] Setting a default quantization params because quantization data is missing for 
[06/28/2024-09:33:51] [V] [TRT] Tactic: 0x0000000000000000 Time: 0.00935143
[06/28/2024-09:33:51] [V] [TRT] Fastest Tactic: 0x00000000000003ea Time: 0.00764006
[06/28/2024-09:33:51] [V] [TRT] *************** Autotuning Reformat: Half(102400,256,1) -> Int8(102400:32,256,1) ***************
[06/28/2024-09:33:51] [V] [TRT] --------------- Timing Runner: Optimizer Reformat(Reformatted query -> <out>) (Reformat)
[06/28/2024-09:33:51] [V] [TRT] Setting a default quantization params because quantization data is missing for 
[06/28/2024-09:33:51] [V] [TRT] Tactic: 0x00000000000003e8 Time: 0.140286
[06/28/2024-09:33:51] [V] [TRT] Setting a default quantization params because quantization data is missing for 
[06/28/2024-09:33:51] [V] [TRT] Tactic: 0x00000000000003ea Time: 0.0254293
[06/28/2024-09:33:51] [V] [TRT] Setting a default quantization params because quantization data is missing for 
[06/28/2024-09:33:51] [V] [TRT] Tactic: 0x0000000000000000 Time: 0.140142
[06/28/2024-09:33:51] [V] [TRT] Fastest Tactic: 0x00000000000003ea Time: 0.0254293
[06/28/2024-09:33:51] [V] [TRT] *************** Autotuning Reformat: Half(102400:2,256,1) -> Float(102400,256,1) ***************
[06/28/2024-09:33:51] [V] [TRT] --------------- Timing Runner: Optimizer Reformat(Reformatted query -> <out>) (Reformat)
[06/28/2024-09:33:51] [V] [TRT] Setting a default quantization params because quantization data is missing for 
[06/28/2024-09:33:51] [V] [TRT] Tactic: 0x00000000000003e8 Time: 0.00573239
[06/28/2024-09:33:51] [V] [TRT] Setting a default quantization params because quantization data is missing for 
[06/28/2024-09:33:51] [V] [TRT] Tactic: 0x00000000000003ea Time: 0.0195657
[06/28/2024-09:33:51] [V] [TRT] Setting a default quantization params because quantization data is missing for 
[06/28/2024-09:33:51] [V] [TRT] Tactic: 0x0000000000000000 Time: 0.00462216
[06/28/2024-09:33:51] [V] [TRT] Fastest Tactic: 0x0000000000000000 Time: 0.00462216
[06/28/2024-09:33:51] [V] [TRT] *************** Autotuning Reformat: Half(102400:2,256,1) -> Float(1,256,1) ***************
[06/28/2024-09:33:51] [V] [TRT] --------------- Timing Runner: Optimizer Reformat(Reformatted query -> <out>) (Reformat)
[06/28/2024-09:33:51] [V] [TRT] Setting a default quantization params because quantization data is missing for 
[06/28/2024-09:33:51] [V] [TRT] Tactic: 0x00000000000003e8 Time: 0.0051329
[06/28/2024-09:33:51] [V] [TRT] Setting a default quantization params because quantization data is missing for 
[06/28/2024-09:33:51] [V] [TRT] Tactic: 0x00000000000003ea Time: 0.77824
[06/28/2024-09:33:51] [V] [TRT] Setting a default quantization params because quantization data is missing for 
[06/28/2024-09:33:51] [V] [TRT] Tactic: 0x0000000000000000 Time: 0.0174068
[06/28/2024-09:33:51] [V] [TRT] Fastest Tactic: 0x00000000000003e8 Time: 0.0051329
[06/28/2024-09:33:51] [V] [TRT] *************** Autotuning Reformat: Half(102400:2,256,1) -> Float(1:4,256,1) ***************
